position,lng,lat
浦东新区光明村,0,0
浦东新区通济路328弄,0,0
浦东新区工农南路201弄,0,0
浦东新区佳乐路225弄,0,0
浦东新区松林路333弄,0,0
浦东新区五莲路1047弄,0,0
浦东新区微山二村,0,0
浦东新区环龙路263弄,0,0
浦东新区张杨路1050弄,0,0
浦东新区羽山路1445弄,0,0
浦东新区北洋泾路601号,0,0
浦东新区陈春东路99弄,0,0
浦东新区下南路370弄,0,0
浦东新区沪南路2518弄,0,0
浦东新区浦电路328号,0,0
浦东新区御衡路68弄,0,0
浦东新区浦三路741弄,0,0
浦东新区下南路551弄,0,0
浦东新区浦东南路1700弄,0,0
浦东新区东明路560号,0,0
浦东新区浦电路29弄,0,0
浦东新区成山路300弄,0,0
浦东新区东建新村,0,0
浦东新区齐河路438弄,0,0
浦东新区五莲路108弄,0,0
浦东新区昌里东路80弄,0,0
浦东新区峨山路500弄,0,0
浦东新区下南路339弄,0,0
浦东新区上南路3300号,0,0
浦东新区下南路320弄,0,0
浦东新区云台路183弄,0,0
浦东新区下南路500弄,0,0
浦东新区德州路230弄,0,0
浦东新区杨莲路311弄,0,0
浦东新区新浦路673弄,0,0
浦东新区崂山路644弄,0,0
浦东新区浦电路53弄,0,0
浦东新区昌里东路71弄,0,0
浦东新区下南路276弄,0,0
浦东新区博华路999弄,0,0
浦东新区东明路355弄,0,0
浦东新区下南路526弄,0,0
浦东新区蓝村路471弄,0,0
浦东新区德州路255弄,0,0
浦东新区下南路50弄,0,0
浦东新区洪山路237弄,0,0
浦东新区板泉路2101弄,0,0
浦东新区上南路929弄,0,0
浦东新区昌里路80弄,0,0
浦东新区下南路501弄,0,0
浦东新区三旋路506弄,0,0
浦东新区上南路6500弄,0,0
浦东新区云莲路398弄,0,0
浦东新区博兴路616弄,0,0
浦东新区东明路660弄,0,0
浦东新区莱阳路350弄,0,0
浦东新区张杨路1734弄,0,0
浦东新区东靖路669弄,0,0
浦东新区德平路100弄,0,0
浦东新区周园路1800弄,0,0
浦东新区金高路988弄,0,0
浦东新区浦城路580弄,0,0
浦东新区卫民村,0,0
浦东新区高青路4567弄,0,0
浦东新区潍坊路168弄,0,0
浦东新区南码头路1120弄,0,0
浦东新区五星村陈家队陈家宅,0,0
浦东新区崂山路502号,0,0
浦东新区康沈路400弄,0,0
浦东新区南团公路858弄,0,0
浦东新区立新村,0,0
浦东新区鹿溪村,0,0
浦东新区懿行路971弄,0,0
浦东新区上南路2779号,0,0
浦东新区潍坊路606号,0,0
浦东新区张杨路1000弄,0,0
浦东新区成山路475弄,0,0
浦东新区绿林路320弄,0,0
浦东新区赵家厍,0,0
浦东新区浦电路218弄,0,0
浦东新区杨思路855弄,0,0
浦东新区上南路5588号,0,0
浦东新区张杨路310弄,0,0
浦东新区耀华路200弄,0,0
浦东新区联勤村张家队张家宅,0,0
浦东新区林展路267弄,0,0
浦东新区上南路5600号,0,0
浦东新区杨高南路5055弄,0,0
浦东新区南新村吴家宅,0,0
浦东新区庆利路185弄,0,0
浦东新区成山路350弄,0,0
浦东新区成山路1728弄,0,0
浦东新区成山路210号,0,0
浦东新区康士路15弄,0,0
浦东新区昌里路98弄,0,0
浦东新区天花庵村,0,0
浦东新区祝西村,0,0
浦东新区耀华路421弄,0,0
浦东新区五星村徐家队奚家宅,0,0
浦东新区莱阳路451弄,0,0
浦东新区东方路1523号,0,0
浦东新区康沈路465弄,0,0
浦东新区巨野路大陆家宅,0,0
浦东新区南码头路1696弄,0,0
浦东新区康桥路90弄,0,0
浦东新区高科西路961号,0,0
浦东新区崂山路640号,0,0
浦东新区曹路镇顾家宅,0,0
浦东新区新浦路587弄,0,0
浦东新区上南路1251弄,0,0
浦东新区一六村金桥队南赵家宅,0,0
浦东新区浦电路330弄,0,0
浦东新区昌里东路550弄,0,0
浦东新区卫行村朱家队朱家宅,0,0
浦东新区上南路3521号,0,0
浦东新区上南新村,0,0
浦东新区羽山路780号,0,0
浦东新区三灶村,0,0
浦东新区蓝村路470弄,0,0
浦东新区齐河路909弄,0,0
浦东新区浦电路305弄,0,0
浦东新区牌楼村,0,0
浦东新区昌里路340弄,0,0
浦东新区通济路47弄,0,0
浦东新区昌里东路650弄,0,0
浦东新区御桥村姚家队姚家宅,0,0
浦东新区浦电路155号,0,0
浦东新区沪南路2000号,0,0
浦东新区芳华路916弄,0,0
浦东新区光辉村,0,0
浦东新区浦电路331弄,0,0
浦东新区康桥路1633弄,0,0
浦东新区周市路66号,0,0
浦东新区龙居路179号,0,0
浦东新区浦东南路1475弄,0,0
浦东新区黄路村,0,0
浦东新区鹤驰路99弄,0,0
浦东新区苗圃路266号,0,0
浦东新区南泉路1300弄,0,0
浦东新区御山路360弄,0,0
浦东新区川沙路326弄,0,0
浦东新区南新村,0,0
浦东新区南新村西钟家宅,0,0
浦东新区京浦路82弄,0,0
浦东新区耀华路579弄,0,0
浦东新区康山路608弄,0,0
浦东新区海阳路815弄,0,0
浦东新区秀沿路2501弄,0,0
浦东新区德州路380弄,0,0
浦东新区新陈路303弄,0,0
浦东新区南泉路1350弄,0,0
浦东新区康桥路1055号,0,0
浦东新区新浦路543弄,0,0
浦东新区高青路2861弄,0,0
浦东新区浦电路56号,0,0
浦东新区汤巷中心村,0,0
浦东新区秀沿西路68弄,0,0
浦东新区环桥路1136弄,0,0
浦东新区永泰路775弄,0,0
浦东新区霍山路201弄,0,0
浦东新区北蔡镇黄家队黄家宅,0,0
浦东新区黄楼村谢家宅,0,0
浦东新区浦三路635弄,0,0
浦东新区花木路500弄,0,0
浦东新区高宝路379弄,0,0
浦东新区南码头路1136弄,0,0
浦东新区幸福村幸福公寓,0,0
浦东新区团结村,0,0
浦东新区英雄村,0,0
浦东新区通济路365弄,0,0
浦东新区听悦路960号,0,0
浦东新区靖海路547弄,0,0
浦东新区西门路121弄,0,0
浦东新区西门村,0,0
浦东新区栖山路400弄,0,0
浦东新区扶栏村,0,0
浦东新区羽山路1446弄,0,0
浦东新区洋泾镇路117号,0,0
浦东新区桃林路189号,0,0
浦东新区迎春路1355弄,0,0
浦东新区博山路50弄,0,0
浦东新区羽山路998弄,0,0
浦东新区栖山路99号,0,0
浦东新区浦东大道2894号,0,0
浦东新区金桥路1250弄,0,0
浦东新区德平路1189弄,0,0
浦东新区成山路648弄,0,0
浦东新区昌里东路320弄,0,0
浦东新区东园三村,0,0
浦东新区羽山路308弄,0,0
浦东新区浦东南路3905弄,0,0
浦东新区齐河路26号,0,0
浦东新区东明路383弄,0,0
浦东新区东环龙路299号,0,0
浦东新区崂山路571弄,0,0
浦东新区果园村,0,0
浦东新区华夏二路350弄,0,0
浦东新区严杨路165弄,0,0
浦东新区御北路235号工地生活区,0,0
浦东新区华夏二路728弄,0,0
浦东新区德州路300弄,0,0
浦东新区南阜村东汤家宅队,0,0
浦东新区历城路100弄,0,0
浦东新区五莲路758弄,0,0
浦东新区荷泽路287弄,0,0
浦东新区长岛路1267弄,0,0
浦东新区长岛路1201弄,0,0
浦东新区博兴路916弄,0,0
浦东新区海霞路493弄,0,0
浦东新区通源东路16号,0,0
浦东新区连民村,0,0
浦东新区会龙村,0,0
浦东新区吉灿路17弄,0,0
浦东新区锦绣路300弄,0,0
浦东新区华夏东路860弄,0,0
浦东新区永泰路133弄,0,0
浦东新区瓦南村,0,0
浦东新区千汇路580弄,0,0
浦东新区星火村,0,0
浦东新区千汇路280弄,0,0
浦东新区金星村,0,0
浦东新区三八村,0,0
浦东新区华星村,0,0
浦东新区祝城路77弄,0,0
浦东新区红三村,0,0
浦东新区先进村,0,0
浦东新区星光村,0,0
浦东新区千汇一村,0,0
浦东新区南祝路258弄,0,0
浦东新区金亭公路619号,0,0
浦东新区美容新村,0,0
浦东新区千汇路1000弄,0,0
浦东新区永春东路70号,0,0
浦东新区千汇三村,0,0
浦东新区杨思北街,0,0
浦东新区洪山路300弄,0,0
浦东新区成山路668弄,0,0
浦东新区南码头路1127弄,0,0
浦东新区杨高南路2828号,0,0
浦东新区东明路511弄,0,0
浦东新区昌里东路333弄,0,0
浦东新区洪山路121弄,0,0
浦东新区德州路223弄,0,0
浦东新区德州路465弄,0,0
浦东新区济阳路65弄,0,0
浦东新区耀华路550弄,0,0
浦东新区牛肚村,0,0
浦东新区康悦路325弄,0,0
浦东新区东滨村纪家宅,0,0
浦东新区晚霞路551号,0,0
浦东新区卫东村周家宅,0,0
浦东新区航昌路376弄,0,0
浦东新区瑞和路269弄,0,0
浦东新区王楼村,0,0
浦东新区瑞和路168弄,0,0
浦东新区航瑞路388弄,0,0
浦东新区鹤沙路188弄,0,0
浦东新区沈庄西街,0,0
浦东新区百曲村,0,0
浦东新区浦电路311号,0,0
浦东新区浦东南路1466弄,0,0
浦东新区潍坊西路100弄,0,0
浦东新区潍坊路335弄,0,0
浦东新区源深路600弄2支弄,0,0
浦东新区北张家浜路28弄,0,0
浦东新区福山路102弄,0,0
浦东新区张杨路951弄,0,0
浦东新区张杨路1269弄,0,0
浦东新区松林路111号,0,0
浦东新区东昌路490弄,0,0
浦东新区张杨路981弄,0,0
浦东新区钦殿街58号,0,0
浦东新区福山路100弄,0,0
浦东新区东方路573弄,0,0
浦东新区杨思镇后长街,0,0
浦东新区商城路1177弄,0,0
浦东新区唐港路1059弄,0,0
浦东新区齐河路259弄,0,0
浦东新区祝家港路155弄,0,0
浦东新区成山路226弄,0,0
浦东新区成山路558号,0,0
浦东新区云台路453弄,0,0
浦东新区川沙镇郭家宅,0,0
浦东新区其成村,0,0
浦东新区新陈路150弄,0,0
浦东新区齐河路27弄,0,0
浦东新区环桥路1488弄,0,0
浦东新区陈行村,0,0
浦东新区华路村,0,0
浦东新区浦东大道2511弄,0,0
浦东新区金沪路1218弄,0,0
浦东新区永乐村,0,0
浦东新区鹤立西路88弄,0,0
浦东新区航昌路199弄,0,0
浦东新区梓康路258号,0,0
浦东新区秀龙村,0,0
浦东新区沿江村,0,0
浦东新区周市路1321号,0,0
浦东新区沈西村,0,0
浦东新区施镇路385弄,0,0
浦东新区迅建村,0,0
浦东新区龚华路50弄,0,0
浦东新区群乐村付家圈,0,0
浦东新区民建村,0,0
浦东新区民区路176弄,0,0
浦东新区民春路501弄,0,0
浦东新区海松路398弄,0,0
浦东新区建新村周家宅,0,0
浦东新区古棕路168弄,0,0
浦东新区民区路260弄,0,0
浦东新区启明村,0,0
浦东新区海鸣路98弄,0,0
浦东新区顾唐路138弄,0,0
浦东新区顾东村,0,0
浦东新区海容路99弄,0,0
浦东新区永和村,0,0
浦东新区康沈路1758弄,0,0
浦东新区北庄村,0,0
浦东新区康沈路1527弄,0,0
浦东新区韵浦路167弄,0,0
浦东新区繁荣东路159号,0,0
浦东新区周星路500弄,0,0
浦东新区瑞阳路693弄,0,0
浦东新区周南村,0,0
浦东新区周东路418弄,0,0
浦东新区周泰路32弄,0,0
浦东新区年家浜路339弄,0,0
浦东新区周东路508弄,0,0
浦东新区年家浜路28弄,0,0
浦东新区周阳路258弄,0,0
浦东新区坦南村,0,0
浦东新区唐陆路1190号,0,0
浦东新区金湘路201弄,0,0
浦东新区佳乐路255弄,0,0
浦东新区碧云路1198号,0,0
浦东新区碧云路86弄,0,0
浦东新区长岛路1398弄,0,0
浦东新区博兴路1268弄,0,0
浦东新区东后老街,0,0
浦东新区新环北路1333弄,0,0
浦东新区仁义村,0,0
浦东新区众安村,0,0
浦东新区新卫村,0,0
浦东新区王桥村,0,0
浦东新区坦西村,0,0
浦东新区合庆镇奚家队杨家宅,0,0
浦东新区合庆镇庆丰村邬家宅,0,0
浦东新区庆利路425号,0,0
浦东新区前哨路231弄,0,0
浦东新区博兴路799弄,0,0
浦东新区荷泽路418弄,0,0
浦东新区张杨北路512弄,0,0
浦东新区川沙路4850弄,0,0
浦东新区南桥路983弄,0,0
浦东新区新德路558弄,0,0
浦东新区绣川路1130号,0,0
浦东新区妙栏路353弄,0,0
浦东新区城南路627弄,0,0
浦东新区江晖路296弄,0,0
浦东新区新东路5号,0,0
浦东新区南桥路1060弄,0,0
浦东新区妙境路124弄,0,0
浦东新区华夏二路1255弄,0,0
浦东新区城南路677号,0,0
浦东新区妙境路600弄,0,0
浦东新区小湾村,0,0
浦东新区妙境路395弄,0,0
浦东新区川环南路921弄,0,0
浦东新区新吉村,0,0
浦东新区银峰路676弄,0,0
浦东新区妙南路265弄,0,0
浦东新区华夏二路200弄,0,0
浦东新区五莲路1168号,0,0
浦东新区柳埠路135弄,0,0
浦东新区金桥路2552弄,0,0
浦东新区瑞浦路77弄,0,0
浦东新区川化新村,0,0
浦东新区桂江路77弄,0,0
浦东新区莲安西路125弄,0,0
浦东新区御青路56弄,0,0
浦东新区杨南路689弄,0,0
浦东新区闵家浜路70弄,0,0
浦东新区张家桥村,0,0
浦东新区新安村,0,0
浦东新区南六公路699弄1支弄,0,0
浦东新区闵家浜路60弄,0,0
浦东新区永业路218弄,0,0
浦东新区永宁路136弄,0,0
浦东新区佳林路115弄,0,0
浦东新区韵涛路36弄,0,0
浦东新区顾三村,0,0
浦东新区上川路中虹家园,0,0
浦东新区永丰村陈家宅,0,0
浦东新区日新村杨薛家宅,0,0
浦东新区永春南路407弄,0,0
浦东新区永春西二路86弄,0,0
浦东新区柴场村,0,0
浦东新区赵桥村,0,0
浦东新区严楼村,0,0
浦东新区浦东大道2970弄,0,0
浦东新区五莲路100弄,0,0
浦东新区兰城路115弄,0,0
浦东新区寿光路75弄,0,0
浦东新区柳埠路142弄,0,0
浦东新区浦东大道3080弄,0,0
浦东新区莱阳路201弄,0,0
浦东新区浦东大道2920弄,0,0
浦东新区东波路258号,0,0
浦东新区长岛路85弄,0,0
浦东新区张杨北路555弄,0,0
浦东新区向东新村,0,0
浦东新区长岛路99号,0,0
浦东新区长岛路259弄,0,0
浦东新区博兴路250弄,0,0
浦东新区莱阳路218号,0,0
浦东新区博兴路456弄,0,0
浦东新区川周公路8288弄,0,0
浦东新区翔川路458弄,0,0
浦东新区川周公路8682号,0,0
浦东新区华戴路299弄,0,0
浦东新区华戴路599弄,0,0
浦东新区民生路818弄,0,0
浦东新区羽山路100弄,0,0
浦东新区区巨野路1700弄,0,0
浦东新区苗圃路218弄,0,0
浦东新区栖山路450弄,0,0
浦东新区巨野路482弄,0,0
浦东新区巨野路197弄,0,0
浦东新区栖山路465弄,0,0
浦东新区灵山路701弄,0,0
浦东新区沈家弄路900弄,0,0
浦东新区浦东大道1700弄,0,0
浦东新区栖山路130弄,0,0
浦东新区北项湾,0,0
浦东新区季景路370弄,0,0
浦东新区新德路341弄,0,0
浦东新区进贤路155弄,0,0
浦东新区川沙路4650弄,0,0
浦东新区新虹村赵家宅,0,0
浦东新区川沙路4028号,0,0
浦东新区虹四村,0,0
浦东新区周秀路168弄,0,0
浦东新区红桥村,0,0
浦东新区姚桥村,0,0
浦东新区梅林村,0,0
浦东新区康达路118弄,0,0
浦东新区瑞福路196弄,0,0
浦东新区瑞安路211弄,0,0
浦东新区祝家港路399弄,0,0
浦东新区瑞阳路81弄,0,0
浦东新区周市路39弄,0,0
浦东新区周汇路158弄,0,0
浦东新区安阁苑,0,0
浦东新区城丰路70弄,0,0
浦东新区新春村朱家宅,0,0
浦东新区城丰路212弄,0,0
浦东新区芙蓉路81弄,0,0
浦东新区创新西路199弄,0,0
浦东新区民丰村李家宅,0,0
浦东新区民丰村龚家宅,0,0
浦东新区唐镇新街,0,0
浦东新区吕三村南蒋家宅,0,0
浦东新区民丰村北黄家宅,0,0
浦东新区行南路900弄,0,0
浦东新区北新园路460弄,0,0
浦东新区高宝路68弄,0,0
浦东新区陆凌村宋家宅,0,0
浦东新区清溪路260弄,0,0
浦东新区望三村东唐家宅,0,0
浦东新区航城三路86弄,0,0
浦东新区航城三路288弄,0,0
浦东新区施湾二路766弄,0,0
浦东新区航城五路151弄,0,0
浦东新区金高路1620号,0,0
浦东新区金高路2131弄,0,0
浦东新区祥安路149弄,0,0
浦东新区博兴路1676弄,0,0
浦东新区长岛路1338弄,0,0
浦东新区荷泽路828弄,0,0
浦东新区凌河路38弄,0,0
浦东新区营前村,0,0
浦东新区晚霞路715弄,0,0
浦东新区大沟村,0,0
浦东新区清溪路299弄,0,0
浦东新区冬融路25弄,0,0
浦东新区秋霞路300弄,0,0
浦东新区春晖路446弄,0,0
浦东新区行泰路150弄,0,0
浦东新区荷泽路25弄,0,0
浦东新区长岛路1203弄,0,0
浦东新区双桥路220弄,0,0
浦东新区平度路388弄,0,0
浦东新区双桥路180弄,0,0
浦东新区荷泽路58弄,0,0
浦东新区台儿庄路663弄,0,0
浦东新区东陆路1018弄,0,0
浦东新区博兴路760弄,0,0
浦东新区东陆路898弄,0,0
浦东新区金工路172弄,0,0
浦东新区长岛路1560弄,0,0
浦东新区金工路133弄,0,0
浦东新区五莲路959弄,0,0
浦东新区向城路19号,0,0
浦东新区向城路29号,0,0
浦东新区崂山路551弄,0,0
浦东新区潍坊西路1弄,0,0
浦东新区张杨路1338号,0,0
浦东新区潍坊西路2弄,0,0
浦东新区张杨路1308号,0,0
浦东新区潍坊路89弄,0,0
浦东新区潍坊路126弄,0,0
浦东新区福山路519号,0,0
浦东新区崂山路645弄,0,0
浦东新区浦电路48弄,0,0
浦东新区浦东南路1200号,0,0
浦东新区商城路48弄,0,0
浦东新区海桥村,0,0
浦东新区福善村,0,0
浦东新区环镇东路185弄,0,0
浦东新区丰桥村,0,0
浦东新区航鹤路1858弄,0,0
浦东新区鹤东村,0,0
浦东新区莱阳路301弄,0,0
浦东新区博兴路465弄,0,0
浦东新区利津路555弄,0,0
浦东新区寿光路161弄,0,0
浦东新区利津路53弄,0,0
浦东新区周东路191弄,0,0
浦东新区周东南路388弄,0,0
浦东新区高博路210弄,0,0
浦东新区凌河路618弄,0,0
浦东新区民义村,0,0
浦东新区灵山路1840弄,0,0
浦东新区灵山路1726弄,0,0
浦东新区栖山路1861弄,0,0
浦东新区万德路45弄,0,0
浦东新区栖山路1578弄,0,0
浦东新区德平路1065弄,0,0
浦东新区银山路72弄,0,0
浦东新区张杨路2999弄,0,0
浦东新区栖山路1855号,0,0
浦东新区德平路1134弄,0,0
浦东新区金台路200弄,0,0
浦东新区栖山路1689弄,0,0
浦东新区居家桥路1030弄,0,0
浦东新区金台路115弄,0,0
浦东新区金台路1490弄,0,0
浦东新区羽山路1950弄,0,0
浦东新区博山东路459弄,0,0
浦东新区栖山路1558弄,0,0
浦东新区云山路839弄,0,0
浦东新区栖山路1899弄,0,0
浦东新区德平路1060弄,0,0
浦东新区德平路58弄,0,0
浦东新区博山东路20弄,0,0
浦东新区灵山路1671弄,0,0
浦东新区罗山四村,0,0
浦东新区德平路1066弄,0,0
浦东新区川周路8828弄,0,0
浦东新区妙川路800弄,0,0
浦东新区妙栏路200弄,0,0
浦东新区长桥村南乔家宅,0,0
浦东新区六团周家宅,0,0
浦东新区普庆路115弄,0,0
浦东新区凌空路55弄,0,0
浦东新区庆星村顾家宅,0,0
浦东新区东风村,0,0
浦东新区创业路798号,0,0
浦东新区合庆庆星村西圈夏家宅,0,0
浦东新区合庆镇前哨村马家宅,0,0
浦东新区庆丰村,0,0
浦东新区庆滨路155弄,0,0
浦东新区海塘村南海唐宅,0,0
浦东新区前哨村三队顾家宅,0,0
浦东新区博兴路986弄,0,0
浦东新区勤益村顾家宅,0,0
浦东新区康弘路580弄,0,0
浦东新区德爱路380弄,0,0
浦东新区潍坊路335弄2支弄,0,0
浦东新区浦电路57号,0,0
浦东新区浦东南路1550弄,0,0
浦东新区潍坊路335弄3支弄,0,0
浦东新区源深路600弄,0,0
浦东新区永新村,0,0
浦东新区踊跃村,0,0
浦东新区高宝路300弄,0,0
浦东新区高东二路118弄,0,0
浦东新区德平路155弄,0,0
浦东新区金浜村金家浜,0,0
浦东新区德平路764弄,0,0
浦东新区云山路1395弄,0,0
浦东新区德平路730弄,0,0
浦东新区板泉路2000弄,0,0
浦东新区新村路59弄,0,0
浦东新区长清路967弄,0,0
浦东新区鹤鸣村,0,0
浦东新区严中路300弄,0,0
浦东新区牡丹路258弄,0,0
浦东新区丁香路901弄,0,0
浦东新区新川路995弄,0,0
浦东新区严民路251弄,0,0
浦东新区芳华路310弄,0,0
浦东新区芳华路630弄,0,0
浦东新区海阳路1125弄,0,0
浦东新区东三街15弄,0,0
浦东新区黄楼村张家宅,0,0
浦东新区药师新村,0,0
浦东新区合庆镇庆丰村龚家宅,0,0
浦东新区祝潘公路301弄,0,0
浦东新区运通路728弄,0,0
浦东新区妙明北路116弄,0,0
浦东新区妙境路162弄,0,0
浦东新区妙境北路451号,0,0
浦东新区妙境北路323号,0,0
浦东新区妙境北路65号,0,0
浦东新区跃进新村,0,0
浦东新区利川路501弄,0,0
浦东新区东川公路5979号,0,0
浦东新区祝城路85弄,0,0
浦东新区广益路9弄,0,0
浦东新区栖山路100弄,0,0
浦东新区崮山路1445弄,0,0
浦东新区苗圃路400弄,0,0
浦东新区灵山路1390弄,0,0
浦东新区园艺村,0,0
浦东新区镇南村,0,0
浦东新区丁香路999弄,0,0
浦东新区牡丹路340弄,0,0
浦东新区唐陆路139号,0,0
浦东新区佳林路962弄,0,0
浦东新区唐四村,0,0
浦东新区前进村顾家宅,0,0
浦东新区中界村沈家队沈家宅,0,0
浦东新区新虹村东包家宅,0,0
浦东新区荷泽路825弄,0,0
浦东新区南泉路1261号,0,0
浦东新区南泉路1200弄,0,0
浦东新区南泉路1250弄,0,0
浦东新区川沙路688号,0,0
浦东新区龚路支路473弄,0,0
浦东新区新星村,0,0
浦东新区航梅路526弄,0,0
浦东新区航头路1027弄,0,0
浦东新区清溪路430号,0,0
浦东新区张杨北路4555弄,0,0
浦东新区和龙路241号,0,0
浦东新区和龙路295弄,0,0
浦东新区云台路98号,0,0
浦东新区成山路963弄,0,0
浦东新区行德路141弄,0,0
浦东新区东高路26弄,0,0
浦东新区高博路188弄,0,0
浦东新区洲海路1088弄,0,0
浦东新区民生路423弄,0,0
浦东新区商城路918弄,0,0
浦东新区北中路354弄,0,0
浦东新区银城中路8号,0,0
浦东新区昌邑路607弄,0,0
浦东新区浦明路233弄,0,0
浦东新区江绣路633弄,0,0
浦东新区江绣路300弄,0,0
浦东新区双桥路1108弄,0,0
浦东新区南桥路1152弄,0,0
浦东新区城丰路288弄,0,0
浦东新区城丰路245号,0,0
浦东新区新德西路99弄,0,0
浦东新区祝家港路225号,0,0
浦东新区浦电路108弄,0,0
浦东新区卫行村顾家宅,0,0
浦东新区年家浜路159弄,0,0
浦东新区上南路7718弄,0,0
浦东新区祝家港路138弄,0,0
浦东新区年家浜路366弄,0,0
浦东新区川周公路4293弄,0,0
浦东新区康沈路1602弄,0,0
浦东新区沈梅东路300弄,0,0
浦东新区周园路1680弄,0,0
浦东新区周市路148号,0,0
浦东新区周邓公路6600弄,0,0
浦东新区周康路869弄,0,0
浦东新区年家浜路461弄,0,0
浦东新区川周公路4003弄,0,0
浦东新区关岳路229弄,0,0
浦东新区窑港路188号,0,0
浦东新区陈春路620弄,0,0
浦东新区环林东路271弄,0,0
浦东新区世博家园大道站路94弄,0,0
浦东新区灵山路785弄,0,0
浦东新区浦东大道1851弄,0,0
浦东新区民生路369弄,0,0
浦东新区桃林路815弄,0,0
浦东新区杨高中路2168弄,0,0
浦东新区灵山路600弄,0,0
浦东新区苗圃路600弄,0,0
浦东新区羽山路851弄,0,0
浦东新区博山路199号,0,0
浦东新区高青路2878弄,0,0
浦东新区南码头路260弄,0,0
浦东新区兰陵路24弄,0,0
浦东新区华丰路51弄,0,0
浦东新区东方路3521号,0,0
浦东新区沪南公路3150弄,0,0
浦东新区西泰林路901弄,0,0
浦东新区东波路585弄,0,0
浦东新区金桥路715号,0,0
浦东新区寿光路78弄,0,0
浦东新区龙阳路1629号,0,0
浦东新区民丰村龚家祠堂,0,0
浦东新区潍坊路333弄,0,0
浦东新区鹤韵路549弄,0,0
浦东新区周秀路118弄,0,0
浦东新区东陆路429弄,0,0
浦东新区金家村陈家宅,0,0
浦东新区新川路922弄,0,0
浦东新区益江路126弄,0,0
浦东新区浦电路221号,0,0
浦东新区浦东大道2311号,0,0
浦东新区杨南路1899弄,0,0
浦东新区浦电路307号,0,0
浦东新区浦电路489号工地生活区,0,0
浦东新区秀沿路1028弄2支弄,0,0
浦东新区东三里桥路160弄,0,0
浦东新区大同路668弄,0,0
浦东新区牡丹路145弄,0,0
浦东新区临沂路81弄,0,0
浦东新区芳华路713弄,0,0
浦东新区华夏东路2026弄,0,0
浦东新区唐陆公路3312号,0,0
浦东新区直属村,0,0
浦东新区浦东南路1533号,0,0
浦东新区中林街33弄,0,0
浦东新区康杉路359弄,0,0
浦东新区北蔡镇北中路周家宅,0,0
浦东新区鹏飞路426弄,0,0
浦东新区红旗村江湖宅,0,0
浦东新区五莲路1424弄,0,0
浦东新区栖山路401弄,0,0
浦东新区高宝路229弄,0,0
浦东新区北张家浜路58号,0,0
浦东新区利津路385弄,0,0
浦东新区创新中路593弄,0,0
浦东新区砖桥路180弄,0,0
浦东新区三林路910号,0,0
浦东新区航瑞路175弄,0,0
浦东新区大瞿家宅,0,0
浦东新区华绣路393号,0,0
浦东新区张杨路370弄,0,0
浦东新区营房村,0,0
浦东新区长岛路800弄,0,0
浦东新区徳品路1189弄,0,0
浦东新区瑞意路399弄,0,0
浦东新区尚博路799弄,0,0
浦东新区陈春东路88弄,0,0
浦东新区杨高南路2772弄,0,0
浦东新区源深路600弄3支弄,0,0
