position,lng,lat
浦东新区张东路2281弄,0,0
浦东新区临江村西新队罗汉松,0,0
浦东新区临江村丁家队丁家宅,0,0
浦东新区浦电路221号,0,0
浦东新区龚路支路473弄,0,0
浦东新区繁荣东路159弄,0,0
浦东新区建新村,0,0
浦东新区新川路709弄,0,0
浦东新区瑞阳路81弄,0,0
浦东新区下南路500弄,0,0
浦东新区年家浜路461弄,0,0
浦东新区利津路1313弄,0,0
浦东新区千汇路198弄,0,0
浦东新区张江诸家宅,0,0
浦东新区民耀路227弄,0,0
浦东新区上川路620号,0,0
浦东新区瑞安路700弄,0,0
浦东新区海阳路1001弄,0,0
浦东新区新环西路27号,0,0
浦东新区东书房路560弄,0,0
浦东新区沪东新村,0,0
浦东新区妙境北路323号,0,0
浦东新区南塘村顾家宅,0,0
浦东新区靖海南路567弄,0,0
浦东新区潍坊七村,0,0
浦东新区银冬路568号,0,0
浦东新区江绣路633弄,0,0
浦东新区沈家弄路801弄,0,0
浦东新区鹏飞路411弄,0,0
浦东新区航鹤路1858弄,0,0
浦东新区中界村陈家队陈家宅,0,0
浦东新区卫行村朱家队朱家宅,0,0
浦东新区浦电路149弄,0,0
浦东新区一心村,0,0
浦东新区洪山路1889弄,0,0
浦东新区苗圃路400弄,0,0
浦东新区莲振路269号,0,0
浦东新区上南路3827弄,0,0
浦东新区云山路1415弄,0,0
浦东新区康沈路465弄,0,0
浦东新区杨思路502弄,0,0
浦东新区华夏二路1255弄,0,0
浦东新区关岳路181弄,0,0
浦东新区长岛路1560弄,0,0
浦东新区金桥路530弄,0,0
浦东新区灵岩南路1065号,0,0
浦东新区创新中路380弄,0,0
浦东新区御青路918弄,0,0
浦东新区五星村三联队黄家宅,0,0
浦东新区天花庵村芦家队芦家油车,0,0
浦东新区施湾二路766弄,0,0
浦东新区光明村,0,0
浦东新区浦东大道1097号,0,0
浦东新区联勤村冯桥队冯家宅,0,0
浦东新区启明村,0,0
浦东新区陈胡村,0,0
浦东新区园洲路189弄,0,0
浦东新区南码头路1349弄,0,0
浦东新区卫行村张浜队顾家宅,0,0
浦东新区康杉路359弄,0,0
浦东新区前进村东窑队南李家宅,0,0
浦东新区下南路370弄,0,0
浦东新区川周公路4318弄,0,0
浦东新区林德路718弄,0,0
浦东新区五莲路1047弄,0,0
浦东新区罗山路1700弄,0,0
浦东新区上南路3521号,0,0
浦东新区下南路320弄,0,0
浦东新区东方路3344弄,0,0
浦东新区环东中心村,0,0
浦东新区博山路12弄,0,0
浦东新区博华路999弄,0,0
浦东新区柳埠路135弄,0,0
浦东新区瑞意路399弄,0,0
浦东新区德州路255弄,0,0
浦东新区金业路72号,0,0
浦东新区灵山路1390弄,0,0
浦东新区银峰路676弄,0,0
浦东新区五星村陈家队陈家宅,0,0
浦东新区城南村一队朱家宅,0,0
浦东新区东方路573弄,0,0
浦东新区临江村王家宅,0,0
浦东新区周市路380弄,0,0
浦东新区海春路65弄,0,0
浦东新区秀龙村,0,0
浦东新区瑞浦路77弄,0,0
浦东新区康弘路508弄,0,0
浦东新区柳埠路142弄,0,0
浦东新区钱堂村,0,0
浦东新区碧云路86弄,0,0
浦东新区浦东大道2639弄,0,0
浦东新区华夏西路5778号,0,0
浦东新区莲安西路123弄,0,0
浦东新区东陆路429弄,0,0
浦东新区商城路1177弄,0,0
浦东新区高青路4567弄,0,0
浦东新区康士路15弄,0,0
浦东新区金口路471弄,0,0
浦东新区周秀路118弄,0,0
浦东新区严杨路45弄,0,0
浦东新区浦东大道1623弄,0,0
浦东新区兰陵路24弄,0,0
浦东新区南新村西钟家宅,0,0
浦东新区长岛路825弄,0,0
浦东新区板泉路2000弄,0,0
浦东新区东陆路1018弄,0,0
浦东新区周康路169号,0,0
浦东新区杨高北路3885弄,0,0
浦东新区鹤永路751弄,0,0
浦东新区临江村益民队罗汉松,0,0
浦东新区周园路1680弄,0,0
浦东新区霞玉路436弄,0,0
浦东新区盛荣路288弄,0,0
浦东新区御青路56弄,0,0
浦东新区杨莲路310弄,0,0
浦东新区红星村一队张家宅,0,0
浦东新区康弘路515弄,0,0
浦东新区绿林路320弄,0,0
浦东新区德州路465弄,0,0
浦东新区枣庄路998弄,0,0
浦东新区航绣路50弄,0,0
浦东新区金晓路96弄,0,0
浦东新区韩荡村南曹家宅,0,0
浦东新区张家桥村,0,0
浦东新区莲振路298号,0,0
浦东新区寿光路78弄,0,0
浦东新区川沙路1215号,0,0
浦东新区芳华路478弄,0,0
浦东新区周星路500弄,0,0
浦东新区利津路1111弄,0,0
浦东新区联勤村张家宅,0,0
浦东新区兰谷路1888弄,0,0
浦东新区光泽路428弄,0,0
浦东新区金台路200弄,0,0
浦东新区胶东路818弄,0,0
浦东新区永泰路775弄,0,0
浦东新区翔川路458弄,0,0
浦东新区乳山路161弄,0,0
浦东新区博山东路41弄,0,0
浦东新区东陆路1182弄,0,0
浦东新区五星村家务队顾家宅,0,0
浦东新区莲安西路125弄,0,0
浦东新区巨峰路667弄,0,0
浦东新区一六村赵家队南赵家宅,0,0
浦东新区张杨路1269弄,0,0
浦东新区海阳路1080弄,0,0
浦东新区联合村西柴场,0,0
浦东新区上南路7992弄,0,0
浦东新区果园村,0,0
浦东新区博华路1018弄,0,0
浦东新区柳埠路196弄,0,0
浦东新区福山路40弄,0,0
浦东新区南桥路237弄,0,0
浦东新区横桥路136弄,0,0
浦东新区双桥路180弄,0,0
浦东新区浦东大道501弄,0,0
浦东新区莲园路18弄,0,0
浦东新区张杨北路555弄,0,0
浦东新区五莲路959弄,0,0
浦东新区丁香路1089弄,0,0
浦东新区周秀路516弄,0,0
浦东新区陈春路620弄,0,0
浦东新区上南路3333弄,0,0
浦东新区罗山路5011号,0,0
浦东新区招远路19弄,0,0
浦东新区蒋桥村,0,0
浦东新区五星村陈家队奚家宅,0,0
浦东新区芳甸路333弄,0,0
浦东新区博兴路462弄,0,0
浦东新区周市路1321号,0,0
浦东新区康巴路250弄,0,0
浦东新区南新村赵家厍,0,0
浦东新区商城路1317弄,0,0
浦东新区康花路661号工地生活区,0,0
浦东新区栖山路401弄,0,0
浦东新区乳山路200弄,0,0
浦东新区永业路193弄,0,0
浦东新区民丰村李家宅,0,0
浦东新区鹏飞路28弄,0,0
浦东新区浦三路858弄,0,0
浦东新区苗桥路935弄,0,0
浦东新区上南路1251弄,0,0
浦东新区凌河路354弄,0,0
浦东新区浦三路817弄,0,0
浦东新区创业路78弄,0,0
浦东新区勤益村,0,0
浦东新区芳甸路77弄,0,0
浦东新区南阜村,0,0
浦东新区周秀路336弄,0,0
浦东新区御桥村印家队东印家圈,0,0
浦东新区永建路86弄,0,0
浦东新区宁桥路825号,0,0
浦东新区浦三路637弄,0,0
浦东新区北艾路828弄,0,0
浦东新区航东村,0,0
浦东新区五星村南黄队陈家宅,0,0
浦东新区浦三路628弄,0,0
浦东新区红枫路108弄,0,0
浦东新区尚博路650弄,0,0
浦东新区汤巷中心村,0,0
浦东新区新丰村万翔宅,0,0
浦东新区顾东村,0,0
浦东新区胡巷村金家宅,0,0
浦东新区大众村中心新村,0,0
浦东新区施湾二路1026弄,0,0
浦东新区佳虹路50弄,0,0
浦东新区红旗村,0,0
浦东新区羽山路600弄,0,0
浦东新区金高路2131弄,0,0
浦东新区三彩路59弄,0,0
浦东新区瑞建路88弄,0,0
浦东新区拱乐路2400弄,0,0
浦东新区锦绣路666弄,0,0
浦东新区临江村周南队周家宅,0,0
浦东新区崮山路251弄,0,0
浦东新区牟平路154弄,0,0
浦东新区枣庄路399弄,0,0
浦东新区昌里东路71弄,0,0
浦东新区长岛路259弄,0,0
浦东新区金杨路785弄,0,0
浦东新区梅花路230弄,0,0
浦东新区南泉路1211弄,0,0
浦东新区康杉路151弄,0,0
浦东新区成山路558号,0,0
浦东新区上浦路510弄,0,0
浦东新区柴场村,0,0
浦东新区民众村运河-西,0,0
浦东新区康杉路608弄,0,0
浦东新区拱川路561弄,0,0
浦东新区峨山路280弄,0,0
浦东新区锦和路289弄,0,0
浦东新区栏学路328弄,0,0
浦东新区南泉路1111弄,0,0
浦东新区迎春路1355弄,0,0
浦东新区清溪路365弄,0,0
浦东新区龚路公路700号,0,0
浦东新区海鸣路98弄,0,0
浦东新区海容路399弄,0,0
浦东新区龚华路35弄,0,0
浦东新区新安村,0,0
浦东新区清溪路400弄,0,0
浦东新区浦东大道1695弄,0,0
浦东新区花墙村,0,0
浦东新区博山路51弄,0,0
浦东新区成山路350弄,0,0
浦东新区华戴路599弄,0,0
浦东新区瑞浦路8弄,0,0
浦东新区瑞安路80弄,0,0
浦东新区成山路300弄,0,0
浦东新区航瑞路459弄,0,0
浦东新区五莲路1168号,0,0
浦东新区上南路5588号,0,0
浦东新区懿德村,0,0
浦东新区杨思路436弄,0,0
浦东新区金湘路201弄,0,0
浦东新区浦东大道691弄,0,0
浦东新区五莲路593弄,0,0
浦东新区灵山路1415弄,0,0
浦东新区川周公路4011弄,0,0
浦东新区五莲路1769弄,0,0
浦东新区桃林路299弄,0,0
浦东新区秋岚路58弄,0,0
浦东新区南码头路551弄,0,0
浦东新区永业路225弄,0,0
浦东新区严中路140弄,0,0
浦东新区灵山路600弄,0,0
浦东新区御青路999弄,0,0
浦东新区栖山路400弄,0,0
浦东新区严杨路60弄,0,0
浦东新区龙东大道4288弄,0,0
浦东新区胡巷村,0,0
浦东新区年家浜东路129弄,0,0
浦东新区宣春路201号,0,0
浦东新区航头路166号,0,0
浦东新区临江村庞家队庞信隆,0,0
浦东新区五莲路759弄,0,0
浦东新区丁香路910弄,0,0
浦东新区一六村油车队,0,0
浦东新区临江村庞家队庞家宅,0,0
浦东新区一六村金桥队南赵家宅,0,0
浦东新区虹桥村,0,0
浦东新区和平村钱家宅,0,0
浦东新区双店村,0,0
浦东新区尚博路799弄,0,0
浦东新区临江村张塘队张家宅,0,0
浦东新区下南路276弄,0,0
浦东新区和平村龚家宅,0,0
浦东新区东陆路1350弄,0,0
浦东新区学前二村,0,0
浦东新区一六村船舫队,0,0
浦东新区新金桥路230号,0,0
浦东新区巨野路469弄,0,0
浦东新区迅建村,0,0
浦东新区五星村吴家队吴家宅,0,0
浦东新区张杨路1776弄,0,0
浦东新区峨山路500弄,0,0
浦东新区北园路258弄,0,0
浦东新区唐陆公路陈家宅,0,0
浦东新区新虹村赵家宅,0,0
浦东新区虹三村七队龚家宅,0,0
浦东新区前进村唐家宅,0,0
浦东新区上南路929弄,0,0
浦东新区沪南公路7518号,0,0
浦东新区新卫村,0,0
浦东新区韩荡村西丁家宅,0,0
浦东新区碧云路1198号,0,0
浦东新区上南路6393号,0,0
浦东新区林展路411弄,0,0
浦东新区板泉路2101弄,0,0
浦东新区牟平路304弄,0,0
浦东新区高科西路2757弄,0,0
浦东新区巨野路236号,0,0
浦东新区民建村,0,0
浦东新区和龙路295弄,0,0
浦东新区南泉路1300弄,0,0
浦东新区中界村张家队张家宅,0,0
浦东新区巨峰路176弄,0,0
浦东新区永泰路133弄,0,0
浦东新区东陆路1031弄,0,0
浦东新区航亭环路399弄,0,0
浦东新区拱海路78弄,0,0
浦东新区严杨路166弄,0,0
浦东新区张杨路1734弄,0,0
浦东新区张杨路1698弄,0,0
浦东新区浦东大道1851弄,0,0
浦东新区灵山路1724弄,0,0
浦东新区灵山路708弄,0,0
浦东新区碧云路777号,0,0
浦东新区浦东南路1475弄,0,0
浦东新区凌河路188弄,0,0
浦东新区潍坊路154弄,0,0
浦东新区莱阳路111弄,0,0
浦东新区利津路729弄,0,0
浦东新区新建村,0,0
浦东新区五莲路400弄,0,0
浦东新区长岛路1066弄,0,0
浦东新区上南路1000弄,0,0
浦东新区荷泽路567弄,0,0
浦东新区南泉路1250弄,0,0
浦东新区巨野路60弄,0,0
浦东新区浦东大道2511弄,0,0
浦东新区兰城路115弄,0,0
浦东新区顾三村,0,0
浦东新区荷泽路58弄,0,0
浦东新区博山路13弄,0,0
浦东新区上南路6852号,0,0
浦东新区黄华村,0,0
浦东新区浦东大道2641弄,0,0
浦东新区东陆路898弄,0,0
浦东新区浦电路62弄,0,0
浦东新区长清路807弄,0,0
浦东新区南新村东钟家宅,0,0
浦东新区首善街619弄,0,0
浦东新区浦东大道2688号,0,0
浦东新区叠桥村,0,0
浦东新区三林镇徐家宅,0,0
浦东新区东海农场2村,0,0
浦东新区东靖路669弄,0,0
浦东新区宣中路697弄,0,0
浦东新区康桥东路1244号,0,0
浦东新区博山东路440弄,0,0
浦东新区秀沿西路68弄,0,0
浦东新区浦电路218弄,0,0
浦东新区上南路3880弄,0,0
浦东新区宣镇东路628弄,0,0
浦东新区齐河路28弄,0,0
浦东新区金桥路1502弄,0,0
浦东新区荷泽路825弄,0,0
浦东新区张家浜路188弄,0,0
浦东新区康沈路250号,0,0
浦东新区三舒路288弄,0,0
浦东新区川银路81弄,0,0
浦东新区德平路58弄,0,0
浦东新区耀路423弄,0,0
浦东新区临江村筠西队庞家宅,0,0
浦东新区芦云路200弄,0,0
浦东新区新营村张朱家宅,0,0
浦东新区日新村,0,0
浦东新区永和村,0,0
浦东新区浦明路1228弄,0,0
浦东新区东河村,0,0
浦东新区镇南村,0,0
浦东新区浦建路207弄,0,0
浦东新区高桥镇胡家街,0,0
浦东新区康沈路1870弄,0,0
浦东新区海潮村,0,0
浦东新区莱阳路881弄,0,0
浦东新区沪南公路3468弄,0,0
浦东新区杨新路77弄,0,0
浦东新区江东路1992弄,0,0
浦东新区塘北村,0,0
浦东新区海鹏路380弄,0,0
浦东新区康桥路90弄,0,0
浦东新区曹路镇姜薛家宅,0,0
浦东新区长岛路1201弄,0,0
浦东新区东海二村,0,0
浦东新区长岛路85弄,0,0
浦东新区龚华路50弄,0,0
浦东新区民耀路293弄,0,0
浦东新区卫行村顾家队顾家宅,0,0
浦东新区锦绣东路418弄,0,0
浦东新区中林村,0,0
浦东新区沪南公路2688弄,0,0
浦东新区金钻路398弄,0,0
浦东新区妙境路162弄,0,0
浦东新区高博路188弄,0,0
浦东新区民耀路391弄,0,0
浦东新区民同路293弄,0,0
浦东新区瑞安路699弄,0,0
浦东新区中界村黄家队黄家宅,0,0
浦东新区南码头路1186弄,0,0
浦东新区临江村周北队周家宅,0,0
浦东新区利津路215弄,0,0
浦东新区华星村陆家宅,0,0
浦东新区栖山路1489弄,0,0
浦东新区浦东南路1533号,0,0
浦东新区博兴路1676弄,0,0
浦东新区永业路218弄,0,0
浦东新区栖山路1460弄,0,0
浦东新区浦东南路1288号,0,0
浦东新区溪平路425弄,0,0
浦东新区迎春路719号,0,0
浦东新区寿光路31弄,0,0
浦东新区川周公路2828弄,0,0
浦东新区昌里路340弄,0,0
浦东新区灵山路1840弄,0,0
浦东新区牌楼村,0,0
浦东新区栏杆村,0,0
浦东新区成山路24弄,0,0
浦东新区祝家港路155弄,0,0
浦东新区崂山五村,0,0
浦东新区成山路601弄,0,0
浦东新区张杨路2238弄,0,0
浦东新区懿行路971弄,0,0
浦东新区城南路374弄,0,0
浦东新区五莲路1424弄,0,0
浦东新区崂山三村,0,0
浦东新区金家浜,0,0
浦东新区浦东大道2742弄,0,0
浦东新区天花庵村乐耕队,0,0
浦东新区航梅路525号,0,0
浦东新区寿光路161弄,0,0
浦东新区羽山路1445弄,0,0
浦东新区金桥路835弄,0,0
浦东新区新场村,0,0
浦东新区金葵路945弄,0,0
浦东新区巨野路大陆家宅,0,0
浦东新区杨辉村,0,0
浦东新区跃丰村,0,0
浦东新区新奉公路122弄,0,0
浦东新区高宝路229弄,0,0
浦东新区新川路625弄,0,0
浦东新区新环西路1000弄,0,0
浦东新区拱海路79弄,0,0
浦东新区千汇路750弄,0,0
浦东新区浦电路48弄,0,0
浦东新区龙汇路1880弄,0,0
浦东新区千汇路580弄,0,0
浦东新区祥安路36弄,0,0
浦东新区上浦路480弄,0,0
浦东新区乳山二村,0,0
浦东新区千汇路32弄,0,0
浦东新区行德路141弄,0,0
浦东新区康沈路2588弄,0,0
浦东新区长清路773弄,0,0
浦东新区金亭公路619号,0,0
浦东新区五莲路100弄,0,0
浦东新区尚博路366弄,0,0
浦东新区浦东南路2351弄,0,0
浦东新区兰谷路2777弄,0,0
浦东新区济阳路65弄,0,0
浦东新区北中路354弄,0,0
浦东新区沪二小区,0,0
浦东新区秀沿路2875弄,0,0
浦东新区高桥村江家宅,0,0
浦东新区锦安东路458弄,0,0
浦东新区六灶湾村,0,0
浦东新区德平路1060弄,0,0
浦东新区俱进路505弄,0,0
浦东新区浦东大道2740弄,0,0
浦东新区博兴路616弄,0,0
浦东新区康沈路1929弄,0,0
浦东新区莲溪路1099弄,0,0
浦东新区东方路1600弄,0,0
浦东新区莱阳路451弄,0,0
浦东新区东绣路1086弄,0,0
浦东新区张杨北路588弄,0,0
浦东新区北张家浜路188弄,0,0
浦东新区上南四村,0,0
浦东新区大众村王家宅,0,0
浦东新区西门村,0,0
浦东新区劳动村,0,0
浦东新区丁香路1399弄,0,0
浦东新区民生路423号,0,0
浦东新区博兴路986弄,0,0
浦东新区西泥路113弄,0,0
浦东新区红四村,0,0
浦东新区新南村,0,0
浦东新区汤巷村,0,0
浦东新区崮山路311号,0,0
浦东新区永宁路33弄,0,0
浦东新区浦建路83弄,0,0
浦东新区云山路1045弄,0,0
浦东新区荡湾路2号,0,0
浦东新区浦电路311号,0,0
浦东新区新任村,0,0
浦东新区永泰路59弄,0,0
浦东新区夏碧路79弄,0,0
浦东新区季桥村,0,0
浦东新区康桥路1558弄,0,0
浦东新区海春路150弄,0,0
浦东新区浦东大道275弄,0,0
浦东新区浦东大道3076弄,0,0
浦东新区项文路333弄,0,0
浦东新区王桥村,0,0
浦东新区荣科路177弄,0,0
浦东新区沪南路3468弄,0,0
浦东新区杨高北路4705弄,0,0
浦东新区万六村,0,0
浦东新区万和路118弄,0,0
浦东新区御北路235号工地生活区,0,0
浦东新区民雨路333弄,0,0
浦东新区坦西村,0,0
浦东新区笋心路10号,0,0
浦东新区天花庵村南陈队大陈家宅,0,0
浦东新区博山路50弄,0,0
浦东新区新路村,0,0
浦东新区潍坊路140弄,0,0
浦东新区周秀路26弄,0,0
浦东新区南码头路1696弄,0,0
浦东新区东明路660弄,0,0
浦东新区博兴路916弄,0,0
浦东新区东八灶,0,0
浦东新区仁义村,0,0
浦东新区王楼村,0,0
浦东新区荷泽路25弄,0,0
浦东新区芳华路916弄,0,0
浦东新区定水路50弄,0,0
浦东新区康沈公路1300弄,0,0
浦东新区耀华路414弄,0,0
浦东新区妙境路55弄,0,0
浦东新区德州路300弄,0,0
浦东新区周南村,0,0
浦东新区灵山路1799弄,0,0
浦东新区崮山路968号,0,0
浦东新区汇成路1245弄,0,0
浦东新区陈行村一队张家宅,0,0
浦东新区耀华路87弄,0,0
浦东新区民同路176弄,0,0
浦东新区唐陆路石家观音堂,0,0
浦东新区乳山路114弄,0,0
浦东新区周市路66号,0,0
浦东新区牌楼东路528弄,0,0
浦东新区海桥村,0,0
浦东新区东陆路1268弄,0,0
浦东新区长岛路1203弄,0,0
浦东新区长岛路625弄,0,0
浦东新区三林镇金家宅,0,0
浦东新区沪南路2000号,0,0
浦东新区新春村,0,0
浦东新区康沈路1527弄,0,0
浦东新区沪南公路2000号,0,0
浦东新区创新西路199弄,0,0
浦东新区滨海一村西顾家宅,0,0
浦东新区长达村,0,0
浦东新区成山路1712号,0,0
浦东新区长岛路99号,0,0
浦东新区沪南路4851弄,0,0
浦东新区东波路585弄,0,0
浦东新区上南路东明路工地生活区,0,0
浦东新区天花庵村闵北队闵家宅,0,0
浦东新区新镇村谢家宅,0,0
浦东新区新浜村陈家宅,0,0
浦东新区佳林路919弄,0,0
浦东新区光明路61弄,0,0
浦东新区华路村七队蔡家宅,0,0
浦东新区沪南路235号工地生活区,0,0
浦东新区沪南公路5192号,0,0
浦东新区金桥路2552弄,0,0
浦东新区张江镇中心村王家宅,0,0
浦东新区五莲路780弄,0,0
浦东新区佳乐路255弄,0,0
浦东新区德平路1065弄,0,0
浦东新区御桥村姚家宅,0,0
浦东新区长桥村南乔家宅,0,0
浦东新区蓝村路471弄,0,0
浦东新区环林西路613弄,0,0
浦东新区大沟村西王家宅,0,0
浦东新区宣镇东路625弄,0,0
浦东新区成山路648弄,0,0
浦东新区会龙村,0,0
浦东新区环林东路271弄,0,0
浦东新区潘姚村西刘队刘家宅,0,0
浦东新区前进村西李家宅,0,0
浦东新区永业路94弄,0,0
浦东新区芳芯路149弄,0,0
浦东新区周东路529号,0,0
浦东新区德州路254号,0,0
浦东新区罗山路108弄,0,0
浦东新区新环北路1080弄,0,0
浦东新区杨莲路160弄,0,0
浦东新区祝城路84弄,0,0
浦东新区杨新路197弄,0,0
浦东新区鹏岳路152弄,0,0
浦东新区三彩路166弄,0,0
浦东新区李桥村,0,0
浦东新区唐四村王家东宅,0,0
浦东新区广益路15弄,0,0
浦东新区成山路475弄,0,0
浦东新区海霞路135弄,0,0
浦东新区上南三村,0,0
浦东新区庆星八队西圈夏家宅,0,0
浦东新区通济路365弄,0,0
浦东新区南码头路238弄,0,0
浦东新区虹二村沈家宅,0,0
浦东新区坦南村,0,0
浦东新区民雪路108弄,0,0
浦东新区妙境路595弄,0,0
浦东新区东园三村,0,0
浦东新区东靖路119弄,0,0
浦东新区海容路99弄,0,0
浦东新区繁荣路266弄,0,0
浦东新区新吉村,0,0
浦东新区秀沿西路258弄,0,0
浦东新区立新村,0,0
浦东新区秋岚路48弄,0,0
浦东新区共和村陈家宅,0,0
浦东新区鹏飞路333弄,0,0
浦东新区齐爱路99弄,0,0
浦东新区浦东大道1615号,0,0
浦东新区庆星村二队费家宅,0,0
浦东新区里仁村,0,0
浦东新区城南路41弄,0,0
浦东新区博山东路459弄,0,0
浦东新区蓝村路30弄,0,0
浦东新区新农村沈家宅,0,0
浦东新区连民村,0,0
浦东新区东明路355弄,0,0
浦东新区拱乐路698弄,0,0
浦东新区棉场村,0,0
浦东新区兰城路108弄,0,0
浦东新区凤家码头夏家宅,0,0
浦东新区周康新村,0,0
浦东新区拱扱路2626弄,0,0
浦东新区北张家浜路170弄,0,0
浦东新区下南路526弄,0,0
浦东新区罗山路1505号,0,0
浦东新区芳华路933弄,0,0
浦东新区虹二村盛家宅,0,0
浦东新区灵山路1671弄,0,0
浦东新区环林东路799弄,0,0
浦东新区周邓公路6600弄,0,0
浦东新区东建路228弄,0,0
浦东新区西营南路68弄,0,0
浦东新区德平路1134弄,0,0
浦东新区昌里东路190弄,0,0
浦东新区鹿溪村,0,0
浦东新区陈家弄,0,0
浦东新区海阳路1064号,0,0
浦东新区玉盘北路281号,0,0
浦东新区航梅路525弄,0,0
浦东新区民贤路28弄,0,0
浦东新区周埠村,0,0
浦东新区妙境北路451号,0,0
浦东新区洪山路300弄,0,0
浦东新区环林东路799,0,0
浦东新区秀沿路1177弄二支弄,0,0
浦东新区光泽路120弄,0,0
浦东新区学北路165弄,0,0
浦东新区芳华路503弄,0,0
浦东新区江绣路300弄,0,0
浦东新区秀沿路2571弄,0,0
浦东新区申江南路3266号,0,0
浦东新区红旗村李家队李家油车,0,0
浦东新区航鹤路1000弄,0,0
浦东新区成山路248弄,0,0
浦东新区虹二村朱家宅,0,0
浦东新区浦电路489号工地生活区,0,0
浦东新区金杨路660弄,0,0
浦东新区瑞和路101弄,0,0
浦东新区栖山路450弄,0,0
浦东新区龚华路406弄,0,0
浦东新区红旗村镇南队江湖宅,0,0
浦东新区团结村,0,0
浦东新区储楼村,0,0
浦东新区高桥村一队唐家宅,0,0
浦东新区灵山路730弄,0,0
浦东新区三三公路5020弄,0,0
浦东新区海松路398弄,0,0
浦东新区周阳路399弄,0,0
浦东新区南团公路858弄,0,0
浦东新区昌里路167弄,0,0
浦东新区东三街102弄,0,0
浦东新区年家浜路501弄,0,0
浦东新区栖山路1088弄,0,0
浦东新区成日村,0,0
浦东新区佳林路115弄,0,0
浦东新区御青路328弄,0,0
浦东新区昌里东路80弄,0,0
浦东新区桥北村,0,0
浦东新区航头路1137弄,0,0
浦东新区红三村一队唐家宅,0,0
浦东新区东方路1800弄,0,0
浦东新区南码头路1453弄,0,0
浦东新区海松路52弄,0,0
浦东新区五莲路108弄,0,0
浦东新区永乐村,0,0
浦东新区历城路100弄,0,0
浦东新区海院新村,0,0
浦东新区鹏飞路101弄,0,0
浦东新区东陆路1755弄,0,0
浦东新区环桥路1136弄,0,0
浦东新区羽山路383弄,0,0
浦东新区张杨北路558弄,0,0
浦东新区潍坊六村,0,0
浦东新区罗山路1507弄,0,0
浦东新区张家浜路98弄,0,0
浦东新区莲溪路780弄,0,0
浦东新区张杨北路512弄,0,0
浦东新区莱阳路2328弄,0,0
浦东新区高科西路961号,0,0
浦东新区牡丹路186弄,0,0
浦东新区花山路609弄,0,0
浦东新区孙建路815弄,0,0
浦东新区汇成路1118号,0,0
浦东新区芳芯路175弄,0,0
浦东新区京浦路160弄,0,0
浦东新区唐四村费家宅,0,0
浦东新区下南路465弄,0,0
浦东新区虹三村五队赵家宅,0,0
浦东新区寿光路75弄,0,0
浦东新区长丰村四队北唐家宅,0,0
浦东新区航瑞路389弄,0,0
浦东新区博兴路760弄,0,0
浦东新区北艾路1765弄,0,0
浦东新区崮山路322弄,0,0
浦东新区鹤永路600弄,0,0
浦东新区东风村,0,0
浦东新区林展路422弄,0,0
浦东新区永泰路1650弄,0,0
浦东新区东陆路1456弄,0,0
浦东新区先进村,0,0
浦东新区羽山路308弄,0,0
浦东新区鹤鸣村,0,0
