position,lng,lat
静安区昌化路430弄,0,0
静安区昌化路435弄,0,0
静安区昌化路437号,0,0
静安区昌化路443弄,0,0
静安区昌化路509弄,0,0
静安区昌平路250弄,0,0
静安区昌平路88弄,0,0
静安区常德路418号,0,0
静安区常德路999号,0,0
静安区常熟路113弄,0,0
静安区场中路2800弄,0,0
静安区场中路3123弄,0,0
静安区场中路3332弄,0,0
静安区成都北路337号,0,0
静安区成都北路971号,0,0
静安区大沽路398弄,0,0
静安区大沽路541号,0,0
静安区大宁路540弄,0,0
静安区大统路855号,0,0
静安区大统路988弄,0,0
静安区汾西路261弄,0,0
静安区汾西路815弄,0,0
静安区汾西路88弄,0,0
静安区福建北路257号,0,0
静安区富民路148弄,0,0
静安区富民路164弄,0,0
静安区富民路197弄,0,0
静安区高平路774弄,0,0
静安区高平路811号,0,0
静安区共和新路1209弄,0,0
静安区共和新路1229号,0,0
静安区共和新路1233号,0,0
静安区共和新路1725弄,0,0
静安区共和新路970弄,0,0
静安区海防路100弄,0,0
静安区海防路199号,0,0
静安区海防路223弄,0,0
静安区海防路391弄,0,0
静安区海防路406号,0,0
静安区海防路538弄,0,0
静安区海宁路1388弄,0,0
静安区海宁路1399号,0,0
静安区汉中路777弄,0,0
静安区恒丰北路100号,0,0
静安区恒通东路99弄,0,0
静安区沪太路1051弄,0,0
静安区沪太路1059号,0,0
静安区沪太路1170弄,0,0
静安区沪太路617号,0,0
静安区沪太路631弄,0,0
静安区沪太路651弄,0,0
静安区沪太路655弄,0,0
静安区沪太路909弄,0,0
静安区华山路250号,0,0
静安区淮安路687弄,0,0
静安区黄山路230弄,0,0
静安区黄山路280弄,0,0
静安区江宁路28弄,0,0
静安区江宁路772号,0,0
静安区江宁路936弄,0,0
静安区胶州路293弄,0,0
静安区胶州路319弄,0,0
静安区胶州路707弄,0,0
静安区晋元路228弄,0,0
静安区晋元路310弄,0,0
静安区景凤路480弄,0,0
静安区巨鹿路739弄,0,0
静安区巨鹿路889号,0,0
静安区康定东路13弄,0,0
静安区康定路1031弄,0,0
静安区康定路1299弄,0,0
静安区康定路305号,0,0
静安区康定路307号,0,0
静安区康定路389号,0,0
静安区康定路404号,0,0
静安区康定路418弄,0,0
静安区康定路432号,0,0
静安区康定路460弄,0,0
静安区康定路818弄,0,0
静安区康定路900号,0,0
静安区老沪太路206号,0,0
静安区老沪太路255弄,0,0
静安区老沪太路259弄,0,0
静安区老沪太路270号,0,0
静安区临汾路1031号,0,0
静安区临汾路1105弄,0,0
静安区临汾路1165弄,0,0
静安区临汾路1231弄,0,0
静安区临汾路1515弄,0,0
静安区临汾路1564弄,0,0
静安区临汾路1565弄,0,0
静安区临汾路380弄,0,0
静安区临汾路894弄,0,0
静安区灵石路737弄,0,0
静安区灵石路739弄,0,0
静安区柳营路1025弄,0,0
静安区柳营路309弄,0,0
静安区柳营路319弄,0,0
静安区柳营路529号,0,0
静安区洛川东路320弄,0,0
静安区洛川东路400弄,0,0
静安区洛川中路1100弄,0,0
静安区洛川中路600弄,0,0
静安区洛川中路777弄,0,0
静安区洛川中路901弄,0,0
静安区毛家弄26号,0,0
静安区茂名北路118弄,0,0
静安区茂名北路149号,0,0
静安区茂名北路73弄,0,0
静安区茂名北路90弄,0,0
静安区南京西路1025弄,0,0
静安区南京西路1111号,0,0
静安区南京西路1376号,0,0
静安区南京西路789号,0,0
静安区南山路151弄,0,0
静安区南阳路90号,0,0
静安区平顺路790弄,0,0
静安区平顺路825弄,0,0
静安区平型关路121弄,0,0
静安区平型关路2199弄,0,0
静安区平型关路235弄,0,0
静安区平型关路315弄,0,0
静安区平型关路343号,0,0
静安区平型关路351号,0,0
静安区普善路376号,0,0
静安区普善路390弄,0,0
静安区七浦路491号,0,0
静安区曲沃路373弄,0,0
静安区曲沃路470弄,0,0
静安区三泉路1015弄,0,0
静安区三泉路415弄,0,0
静安区三泉路821弄,0,0
静安区山西北路222弄,0,0
静安区陕西北路1155弄,0,0
静安区陕西北路1190弄,0,0
静安区陕西北路119弄,0,0
静安区陕西北路127号,0,0
静安区陕西北路37号,0,0
静安区陕西北路493弄,0,0
静安区陕西北路525弄,0,0
静安区陕西北路535弄,0,0
静安区陕西北路678号,0,0
静安区陕西北路71号,0,0
静安区陕西北路73号,0,0
静安区陕西北路798号,0,0
静安区陕西北路804号,0,0
静安区陕西北路824弄,0,0
静安区陕西北路832弄,0,0
静安区陕西北路850号,0,0
静安区陕西北路860弄,0,0
静安区陕西北路868弄,0,0
静安区陕西南路152号,0,0
静安区升平街41弄,0,0
静安区石门二路330号,0,0
静安区石门一路41弄,0,0
静安区石门一路49弄,0,0
静安区石门一路51号,0,0
静安区石门一路53号,0,0
静安区太阳山路175号,0,0
静安区泰兴路625弄,0,0
静安区塘沽路933号,0,0
静安区天目西路55号,0,0
静安区天目中路520号,0,0
静安区天目中路749弄,0,0
静安区天潼路839号,0,0
静安区万航渡路269弄,0,0
静安区万航渡路320弄,0,0
静安区万航渡路393弄,0,0
静安区万航渡路529号,0,0
静安区万航渡路616号,0,0
静安区万航渡路623弄,0,0
静安区万航渡路661弄,0,0
静安区万航渡路72号,0,0
静安区万荣路1199弄,0,0
静安区万荣路22弄,0,0
静安区万荣路949号,0,0
静安区威海路287弄,0,0
静安区威海路550号,0,0
静安区威海路629弄,0,0
静安区威海路910弄,0,0
静安区威海路971号,0,0
静安区闻喜路1110弄,0,0
静安区闻喜路798号,0,0
静安区闻喜路806弄,0,0
静安区汶水路40号,0,0
静安区汶水路57号,0,0
静安区乌鲁木齐北路28号,0,0
静安区乌镇路46号,0,0
静安区武定路801号,0,0
静安区武定路989弄,0,0
静安区武定西路1398弄,0,0
静安区武宁南路195弄,0,0
静安区武宁南路418弄,0,0
静安区武宁南路438弄,0,0
静安区西宝兴路922弄,0,0
静安区西藏北路1013号,0,0
静安区西藏北路1139号,0,0
静安区西藏北路1308弄,0,0
静安区西康路520号,0,0
静安区西康路892号,0,0
静安区西康路894弄,0,0
静安区西康路896号,0,0
静安区西康路902号,0,0
静安区西康路910弄,0,0
静安区西康路920弄,0,0
静安区襄阳北路44弄,0,0
静安区襄阳北路6弄,0,0
静安区新丰路343号,0,0
静安区新丰路355号,0,0
静安区新丰路360号,0,0
静安区新丰路361号,0,0
静安区新丰路364弄,0,0
静安区新丰路380号,0,0
静安区新丰路381号,0,0
静安区新丰路382号,0,0
静安区新闸路1121号,0,0
静安区新闸路1729号,0,0
静安区新闸路777弄,0,0
静安区延安中路1059号,0,0
静安区延安中路540弄,0,0
静安区延安中路632弄,0,0
静安区延安中路913弄,0,0
静安区延安中路930弄,0,0
静安区延平路123弄,0,0
静安区延平路237弄,0,0
静安区延长路152弄,0,0
静安区延长中路600弄,0,0
静安区延长中路800弄,0,0
静安区阳城路101弄,0,0
静安区阳城路283弄,0,0
静安区永兴路310号,0,0
静安区永兴路595弄,0,0
静安区永兴路636号,0,0
静安区永兴小马路60号,0,0
静安区余姚路19号,0,0
静安区余姚路180号,0,0
静安区余姚路27号,0,0
静安区余姚路321弄,0,0
静安区余姚路456号,0,0
静安区愚园路361弄,0,0
静安区愚园路433弄,0,0
静安区愚园路443弄,0,0
静安区愚园路576弄,0,0
静安区愚园路608弄,0,0
静安区原平路917弄,0,0
静安区长乐路660弄,0,0
静安区长乐路682弄,0,0
静安区长乐路930弄,0,0
静安区长乐路962弄,0,0
静安区长临路200弄,0,0
静安区长临路380弄,0,0
静安区长宁路125号,0,0
静安区长宁路129号,0,0
静安区长宁路155弄,0,0
静安区长宁路165号,0,0
静安区长宁路209弄,0,0
静安区长寿路999弄,0,0
静安区长兴路168弄,0,0
静安区镇宁路200号,0,0
静安区止园路400弄,0,0
静安区芷江西路123弄,0,0
静安区芷江西路26弄,0,0
静安区芷江西路286弄,0,0
静安区芷江西路521弄,0,0
静安区中华新路630号,0,0
静安区中华新路730弄,0,0
静安区中华新路793弄,0,0
静安区中华新路893弄,0,0
静安区中山北路173弄,0,0
静安区中山北路178号,0,0
静安区中山北路180号,0,0
静安区中山北路197弄,0,0
静安区中山北路585号,0,0
静安区中山北路899弄,0,0
静安区中兴路1233弄,0,0
静安区中兴路1340弄,0,0
静安区中兴路1385弄,0,0
静安区中兴路571弄,0,0
静安区中兴路700号,0,0
静安区中兴路702号,0,0
徐汇区安福路49弄,0,0
徐汇区安福路53弄,0,0
徐汇区百花街345弄,0,0
徐汇区百色路133弄,0,0
徐汇区百色路88号,0,0
徐汇区宾阳路50弄,0,0
徐汇区宾阳路62弄,0,0
徐汇区苍梧路5号,0,0
徐汇区漕宝路111号,0,0
徐汇区漕宝路66号,0,0
徐汇区漕宝路86号,0,0
徐汇区漕东支路111弄,0,0
徐汇区漕溪北路737弄,0,0
徐汇区漕溪北路800号,0,0
徐汇区漕溪二村,0,0
徐汇区漕溪路125弄,0,0
徐汇区漕溪路280号,0,0
徐汇区漕溪三村,0,0
徐汇区漕溪四村,0,0
徐汇区漕溪一村,0,0
徐汇区茶陵路159弄,0,0
徐汇区茶陵路195弄,0,0
徐汇区茶陵路225弄,0,0
徐汇区茶陵路345弄,0,0
徐汇区茶陵路75弄,0,0
徐汇区长华路170号,0,0
徐汇区长乐路695弄,0,0
徐汇区长桥八村,0,0
徐汇区长桥七村,0,0
徐汇区长桥三村,0,0
徐汇区长桥四村,0,0
徐汇区长桥新村,0,0
徐汇区大木桥路158弄,0,0
徐汇区大木桥路237弄,0,0
徐汇区大木桥路329号,0,0
徐汇区大木桥路41弄,0,0
徐汇区蝶山路125弄,0,0
徐汇区蝶山路128弄,0,0
徐汇区东安二村,0,0
徐汇区东安路240弄,0,0
徐汇区东安路364弄,0,0
徐汇区东安路50弄,0,0
徐汇区东安路271弄,0,0
徐汇区东安四村,0,0
徐汇区东安五村,0,0
徐汇区东安一村,0,0
徐汇区东兰路121弄,0,0
徐汇区东泉路104弄,0,0
徐汇区东泉路105弄,0,0
徐汇区番禺路700号,0,0
徐汇区汾阳路9弄,0,0
徐汇区丰谷路185弄,0,0
徐汇区丰谷路220弄,0,0
徐汇区丰谷路225弄,0,0
徐汇区丰谷路260弄,0,0
徐汇区丰谷路285弄,0,0
徐汇区枫林路180号,0,0
徐汇区枫林路388号,0,0
徐汇区复兴中路1199号,0,0
徐汇区复兴中路1218弄,0,0
徐汇区复兴中路1226号,0,0
徐汇区复兴中路1340弄,0,0
徐汇区古井路38弄,0,0
徐汇区冠生园路230弄,0,0
徐汇区冠生园路235弄,0,0
徐汇区冠生园路403弄,0,0
徐汇区广元西路349号,0,0
徐汇区广元西路420弄,0,0
徐汇区桂林东街99弄,0,0
徐汇区桂林路70弄,0,0
徐汇区桂林西街111弄,0,0
徐汇区桂林西街201弄,0,0
徐汇区桂平路130号,0,0
徐汇区桂平路258弄,0,0
徐汇区桂平路260弄,0,0
徐汇区虹漕路18号,0,0
徐汇区虹漕路19弄,0,0
徐汇区虹漕南路158弄,0,0
徐汇区虹漕南路718弄,0,0
徐汇区虹漕南路99弄,0,0
徐汇区虹梅南路126弄,0,0
徐汇区虹桥路411弄,0,0
徐汇区湖南路20弄,0,0
徐汇区沪闵路9168号,0,0
徐汇区沪闵路9218号,0,0
徐汇区华发路100弄,0,0
徐汇区华发路180弄,0,0
徐汇区华发路333弄,0,0
徐汇区华发路368弄,0,0
徐汇区华发路406弄,0,0
徐汇区华发路90弄,0,0
徐汇区华发路99弄,0,0
徐汇区华济路28弄,0,0
徐汇区华济路2弄,0,0
徐汇区华泾路1000弄,0,0
徐汇区华泾路599弄,0,0
徐汇区华泾路880弄,0,0
徐汇区华石路88弄,0,0
徐汇区华展路55弄,0,0
徐汇区化工一村,0,0
徐汇区淮海中路1857弄,0,0
徐汇区黄石路169号,0,0
徐汇区汇成二村,0,0
徐汇区汇成五村,0,0
徐汇区汇成一村,0,0
徐汇区汇站街80弄,0,0
徐汇区机场新村,0,0
徐汇区嘉善路117弄,0,0
徐汇区嘉善路140弄,0,0
徐汇区嘉善路143弄,0,0
徐汇区嘉善路169弄,0,0
徐汇区建国西路358弄,0,0
徐汇区建国西路384弄,0,0
徐汇区建国西路395弄,0,0
徐汇区建国西路695弄,0,0
徐汇区江安路58弄,0,0
徐汇区江南二村,0,0
徐汇区江南新村,0,0
徐汇区江南一村,0,0
徐汇区凯滨路183号,0,0
徐汇区凯滨路19弄,0,0
徐汇区凯旋路1688弄,0,0
徐汇区凯旋路3500号,0,0
徐汇区凯旋一村,0,0
徐汇区康健路25弄,0,0
徐汇区老沪闵路1290弄,0,0
徐汇区老沪闵路150弄,0,0
徐汇区老沪闵路790弄,0,0
徐汇区乐山二村,0,0
徐汇区乐山路10弄,0,0
徐汇区乐山路25弄,0,0
徐汇区乐山路6号,0,0
徐汇区乐山三村,0,0
徐汇区乐山支路8弄,0,0
徐汇区零陵北路7弄,0,0
徐汇区零陵路190弄,0,0
徐汇区零陵路250弄,0,0
徐汇区零陵路29弄,0,0
徐汇区零陵路350弄,0,0
徐汇区零陵路365号,0,0
徐汇区零陵路651号,0,0
徐汇区零陵路655号,0,0
徐汇区柳州路374弄,0,0
徐汇区柳州路460号,0,0
徐汇区柳州路588号,0,0
徐汇区柳州路628弄,0,0
徐汇区龙漕路1弄,0,0
徐汇区龙漕路218号,0,0
徐汇区龙漕路51弄,0,0
徐汇区龙漕路58弄,0,0
徐汇区龙漕路66弄,0,0
徐汇区龙川北路436弄,0,0
徐汇区龙恒路280弄,0,0
徐汇区龙华路1881弄,0,0
徐汇区龙华路2373弄,0,0
徐汇区龙华路2518弄,0,0
徐汇区龙华路2381弄,0,0
徐汇区龙华路3100弄,0,0
徐汇区龙华路3166弄,0,0
徐汇区龙华路3208弄,0,0
徐汇区龙华西路1号,0,0
徐汇区龙华西路21弄,0,0
徐汇区龙华西路285弄,0,0
徐汇区龙华西路315弄,0,0
徐汇区龙华西路31弄,0,0
徐汇区龙华西路334弄,0,0
徐汇区龙华西路345弄,0,0
徐汇区龙华西路470弄,0,0
徐汇区龙华西路40号,0,0
徐汇区龙华西路81弄,0,0
徐汇区龙华新村,0,0
徐汇区龙兰路399弄,0,0
徐汇区龙南七村,0,0
徐汇区龙南三村,0,0
徐汇区龙南五村,0,0
徐汇区龙瑞路128弄,0,0
徐汇区龙瑞路77弄,0,0
徐汇区龙山新村,0,0
徐汇区龙水北路900弄,0,0
徐汇区龙水北路989号,0,0
徐汇区龙水南路201号,0,0
徐汇区龙吴路1137弄,0,0
徐汇区龙吴路11弄,0,0
徐汇区龙吴路1323弄,0,0
徐汇区龙吴路1343号,0,0
徐汇区龙吴路13弄,0,0
徐汇区龙吴路15弄,0,0
徐汇区龙吴路1717弄,0,0
徐汇区龙吴路1727弄,0,0
徐汇区龙吴路2388弄,0,0
徐汇区龙吴路2525弄,0,0
徐汇区龙吴路2888弄,0,0
徐汇区龙吴路2889号,0,0
徐汇区龙吴路288弄,0,0
徐汇区龙吴路398弄,0,0
徐汇区龙吴路988弄,0,0
徐汇区龙吴路9弄,0,0
徐汇区龙吟路500弄,0,0
徐汇区罗城路570弄,0,0
徐汇区罗秀二村,0,0
徐汇区罗秀路930弄,0,0
徐汇区罗秀三村,0,0
徐汇区罗秀新村,0,0
徐汇区梅陇八村,0,0
徐汇区梅陇路394弄,0,0
徐汇区梅陇十村,0,0
徐汇区梅陇五村,0,0
徐汇区南昌路615弄,0,0
徐汇区南丹路189弄,0,0
徐汇区南宁路501弄,0,0
徐汇区平江路11弄,0,0
徐汇区蒲汇塘路50号,0,0
徐汇区浦北路21弄,0,0
徐汇区浦北路959弄,0,0
徐汇区钦州北路1018弄,0,0
徐汇区钦州路108弄,0,0
徐汇区钦州路760号,0,0
徐汇区钦州路785弄,0,0
徐汇区钦州路840号,0,0
徐汇区钦州路860号,0,0
徐汇区钦州路880号,0,0
徐汇区钦州路900号,0,0
徐汇区钦州路920号,0,0
徐汇区钦州南路8弄,0,0
徐汇区清真路67弄,0,0
徐汇区清真路99弄,0,0
徐汇区日晖二村,0,0
徐汇区日晖六村,0,0
徐汇区日晖七村,0,0
徐汇区日晖三村,0,0
徐汇区日晖五村,0,0
徐汇区日晖一村,0,0
徐汇区瑞金南路458弄,0,0
徐汇区三江路301弄,0,0
徐汇区陕西南路572弄,0,0
徐汇区陕西南路586号,0,0
徐汇区上中路285号,0,0
徐汇区上中路289弄,0,0
徐汇区上中路511号,0,0
徐汇区上中西路348号,0,0
徐汇区石龙路321号,0,0
徐汇区石龙路33弄,0,0
徐汇区石龙支路27号,0,0
徐汇区双峰路321号,0,0
徐汇区太原路165弄,0,0
徐汇区太原路321弄,0,0
徐汇区天平路43弄,0,0
徐汇区天平路91弄,0,0
徐汇区天钥桥路325号,0,0
徐汇区天钥桥路905弄,0,0
徐汇区天钥桥南路1191号,0,0
徐汇区天钥桥南路1199弄,0,0
徐汇区田林东路414弄,0,0
徐汇区田林路65弄,0,0
徐汇区田林路89弄,0,0
徐汇区田林七村,0,0
徐汇区田林三村,0,0
徐汇区田林十四村,0,0
徐汇区田林十一村,0,0
徐汇区宛南二村,0,0
徐汇区宛南六村,0,0
徐汇区宛南三村,0,0
徐汇区宛南四村,0,0
徐汇区宛南五村,0,0
徐汇区宛南一村,0,0
徐汇区宛平南路200号,0,0
徐汇区宛平南路268弄,0,0
徐汇区宛平南路280号,0,0
徐汇区宛平南路590号,0,0
徐汇区宛平南路656号,0,0
徐汇区宛平南路658号,0,0
徐汇区宛平南路734号,0,0
徐汇区宛平南路19弄,0,0
徐汇区宛平南路255弄,0,0
徐汇区宛平南路65弄,0,0
徐汇区宛平南路968弄,0,0
徐汇区宛平南路788弄,0,0
徐汇区文定路211号,0,0
徐汇区文定路288弄,0,0
徐汇区文定路468弄,0,0
徐汇区乌鲁木齐中路301弄,0,0
徐汇区吴兴路260号,0,0
徐汇区吴中东路500弄,0,0
徐汇区五原路76弄,0,0
徐汇区喜泰路231号,0,0
徐汇区喜泰路247弄,0,0
徐汇区喜泰支路15弄,0,0
徐汇区襄阳南路277弄,0,0
徐汇区襄阳南路388弄,0,0
徐汇区襄阳南路452弄,0,0
徐汇区襄阳南路514弄,0,0
徐汇区小木桥路440弄,0,0
徐汇区小木桥路511弄,0,0
徐汇区小木桥路538弄,0,0
徐汇区斜土路1288弄,0,0
徐汇区斜土路1341弄,0,0
徐汇区斜土路1422弄,0,0
徐汇区斜土路1519弄,0,0
徐汇区斜土路1975弄,0,0
徐汇区斜土路2060弄,0,0
徐汇区斜土路2099弄,0,0
徐汇区斜土路2177号,0,0
徐汇区斜土路2200弄,0,0
徐汇区斜土路2365弄,0,0
徐汇区斜土路2590弄,0,0
徐汇区秀山路15弄,0,0
徐汇区徐虹北路23号,0,0
徐汇区延庆路98号,0,0
徐汇区医学院路72弄,0,0
徐汇区医学院路110弄,0,0
徐汇区宜山路177号,0,0
徐汇区宜山路515号,0,0
徐汇区宜山路518弄,0,0
徐汇区宜山路638号,0,0
徐汇区宜山路665弄,0,0
徐汇区宜山路701弄,0,0
徐汇区永嘉路321弄,0,0
徐汇区永嘉路386弄,0,0
徐汇区永嘉路589号,0,0
徐汇区永康路109弄,0,0
徐汇区永康路181号,0,0
徐汇区永康路37弄,0,0
徐汇区永康路38弄,0,0
徐汇区永康路53号,0,0
徐汇区永康路63号,0,0
徐汇区余庆路80号,0,0
徐汇区裕德路66弄,0,0
徐汇区裕德路92弄,0,0
徐汇区云锦路183弄,0,0
徐汇区云锦路1号,0,0
徐汇区云锦路201弄,0,0
徐汇区云锦路50弄,0,0
徐汇区肇嘉浜路366号,0,0
徐汇区肇嘉浜路661号,0,0
徐汇区肇嘉浜路853弄,0,0
徐汇区中漕路20号,0,0
徐汇区中漕路38弄,0,0
徐汇区中山南二路1057弄,0,0
徐汇区中山南二路135号,0,0
徐汇区中山南二路777弄,0,0
徐汇区中山南二路918弄,0,0
徐汇区中山南二路937弄,0,0
徐汇区中山南二路2031号,0,0
徐汇区中山南二路945弄,0,0
徐汇区中山南二路950弄,0,0
徐汇区中山南二路999弄,0,0
徐汇区中山西路1698弄,0,0
徐汇区中山西路1788弄,0,0
徐汇区中山西路2026号,0,0
长宁区安化路317号,0,0
长宁区安化路323号,0,0
长宁区安龙路698弄,0,0
长宁区安顺路139弄,0,0
长宁区安顺路220弄,0,0
长宁区安顺路231弄（住宅）,0,0
长宁区安顺路240弄（住宅）,0,0
长宁区安顺路271号,0,0
长宁区安顺路285号,0,0
长宁区安顺路351弄,0,0
长宁区安西路658弄,0,0
长宁区安西路676号,0,0
长宁区长宁路320号,0,0
长宁区长宁路396弄（住宅）,0,0
长宁区长宁路398弄,0,0
长宁区长宁路888弄,0,0
长宁区长宁路1135弄,0,0
长宁区长宁路1277弄,0,0
长宁区长宁路1488弄,0,0
长宁区长宁路1600弄（住宅）,0,0
长宁区长宁路1818弄,0,0
长宁区长宁支路133弄,0,0
长宁区长宁支路302弄,0,0
长宁区长宁支路318弄,0,0
长宁区长顺路6号,0,0
长宁区长顺路20号,0,0
长宁区程桥二村,0,0
长宁区定西路710弄,0,0
长宁区定西路1118号,0,0
长宁区定西路1310弄（住宅）,0,0
长宁区法华镇路483弄,0,0
长宁区法华镇路881弄,0,0
长宁区芙蓉江路103弄,0,0
长宁区芙蓉江路276弄（住宅）,0,0
长宁区芙蓉江路388弄,0,0
长宁区福泉路255弄,0,0
长宁区甘溪路100弄,0,0
长宁区古北路211弄（住宅）,0,0
长宁区古北路530弄,0,0
长宁区虹古路333号,0,0
长宁区虹古路377弄（住宅）,0,0
长宁区虹古路410弄（住宅）,0,0
长宁区虹桥机场新村,0,0
长宁区虹桥路1115弄（住宅）,0,0
长宁区虹桥路2222弄（住宅）,0,0
长宁区华山路894弄,0,0
长宁区华阳路20弄,0,0
长宁区华阳路165弄,0,0
长宁区华阳路167号,0,0
长宁区华阳路172弄（住宅）,0,0
长宁区华阳路221号,0,0
长宁区华阳路249弄,0,0
长宁区淮海中路1984弄,0,0
长宁区汇川路88弄,0,0
长宁区剑河路200号,0,0
长宁区剑河路414弄（住宅）,0,0
长宁区剑河路2001弄,0,0
长宁区江苏路82弄（住宅）,0,0
长宁区江苏路186弄,0,0
长宁区江苏路320弄,0,0
长宁区江苏路502弄,0,0
长宁区江苏北路111弄,0,0
长宁区江苏北路113号,0,0
长宁区金钟路333弄（住宅）,0,0
长宁区锦屏路10弄,0,0
长宁区凯旋路1010号,0,0
长宁区林泉路537号,0,0
长宁区娄山关路810弄,0,0
长宁区茅台路250弄,0,0
长宁区茅台路295弄,0,0
长宁区茅台路460弄,0,0
长宁区茅台路597弄,0,0
长宁区茅台路690弄,0,0
长宁区茅台路691弄,0,0
长宁区番禺路222弄（住宅）,0,0
长宁区番禺路290弄,0,0
长宁区平塘路185弄,0,0
长宁区平塘路415弄,0,0
长宁区平武路150弄,0,0
长宁区泉口路185弄,0,0
长宁区水城路40弄,0,0
长宁区水城路47弄,0,0
长宁区水城路372号,0,0
长宁区水城路386弄,0,0
长宁区水城路450弄（住宅）,0,0
长宁区水城路883弄,0,0
长宁区淞虹路692号,0,0
长宁区淞虹路805弄,0,0
长宁区绥宁路897号,0,0
长宁区天山路288弄,0,0
长宁区天山路461弄,0,0
长宁区天山路1890弄,0,0
长宁区天山三村,0,0
长宁区天山四村（住宅）,0,0
长宁区天山五村,0,0
长宁区万航渡路1424弄,0,0
长宁区万航渡路1490号,0,0
长宁区万航渡路1508号,0,0
长宁区万航渡路2088弄,0,0
长宁区万航渡路2505弄,0,0
长宁区万航渡路2534号,0,0
长宁区武定西路1371弄（住宅）,0,0
长宁区武夷路70弄,0,0
长宁区武夷路311弄（住宅）,0,0
长宁区武夷路321弄,0,0
长宁区武夷路337弄,0,0
长宁区武夷路416弄（住宅）,0,0
长宁区武夷路423弄,0,0
长宁区武夷路450弄,0,0
长宁区武夷路491弄（住宅）,0,0
长宁区武夷路519弄,0,0
长宁区武夷路555弄,0,0
长宁区武夷路589号,0,0
长宁区武夷路727弄,0,0
长宁区仙霞路386弄,0,0
长宁区仙霞路451弄,0,0
长宁区仙霞路486弄,0,0
长宁区仙霞路579弄（住宅）,0,0
长宁区仙霞路620弄,0,0
长宁区仙霞路700弄,0,0
长宁区仙霞路750弄,0,0
长宁区仙霞路1225弄,0,0
长宁区仙霞西路500弄,0,0
长宁区仙霞西路585号,0,0
长宁区仙霞西路700弄（住宅）,0,0
长宁区协和路323弄,0,0
长宁区新华路210弄,0,0
长宁区新泾一村,0,0
长宁区新泾二村,0,0
长宁区新泾三村,0,0
长宁区新泾四村,0,0
长宁区新泾八村,0,0
长宁区新渔路150弄,0,0
长宁区延安西路688弄,0,0
长宁区延安西路983号,0,0
长宁区延安西路1000号,0,0
长宁区延安西路1236弄,0,0
长宁区延安西路1503弄,0,0
长宁区延安西路1521弄,0,0
长宁区延安西路1547弄,0,0
长宁区延安西路1558弄,0,0
长宁区延安西路1740弄,0,0
长宁区延安西路2029弄,0,0
长宁区延安西路2055弄,0,0
长宁区延安西路2255弄,0,0
长宁区杨宅路20号,0,0
长宁区伊犁路134弄,0,0
长宁区迎宾二路59号,0,0
长宁区迎宾八路10号,0,0
长宁区愚园路1032弄,0,0
长宁区愚园路1088弄（住宅）,0,0
长宁区愚园路1240号,0,0
长宁区愚园路1355弄（住宅）,0,0
长宁区玉屏南路110弄,0,0
长宁区玉屏南路345弄,0,0
长宁区玉屏南路537弄,0,0
长宁区玉屏南路541号,0,0
长宁区玉屏南路560弄,0,0
长宁区玉屏南路723号,0,0
长宁区昭化路86号,0,0
长宁区昭化路90号,0,0
长宁区昭化路508弄,0,0
长宁区昭化路518弄,0,0
长宁区昭化路555弄,0,0
长宁区昭化路615弄,0,0
长宁区镇宁路391号,0,0
长宁区镇宁路465弄,0,0
长宁区中山西路669弄（住宅）,0,0
长宁区中山西路800弄,0,0
长宁区中山西路1030弄（住宅）,0,0
长宁区遵义路390弄,0,0
长宁区遵义路435弄,0,0
长宁区遵义路780弄,0,0
长宁区遵义路800弄,0,0
普陀区安远路188弄,0,0
普陀区安远路230弄,0,0
普陀区安远路294弄,0,0
普陀区澳门路356号,0,0
