position,lng,lat普陀区澳门路519弄,0,0
普陀区澳门路660弄,0,0
普陀区澳门路698弄,0,0
普陀区澳门路88弄,0,0
普陀区白丽路185弄,0,0
普陀区白丽路401弄,0,0
普陀区白丽路99弄,0,0
普陀区曹安路295号,0,0
普陀区曹杨路1261号,0,0
普陀区曹杨一村,0,0
普陀区曹杨五村,0,0
普陀区昌化路977弄,0,0
普陀区昌化路994弄,0,0
普陀区长寿路1118号,0,0
普陀区长寿路181弄,0,0
普陀区长寿路237号,0,0
普陀区长寿路360号,0,0
普陀区长寿路555号,0,0
普陀区长寿路636号,0,0
普陀区长寿路800弄,0,0
普陀区长寿路818弄,0,0
普陀区常德路1185弄,0,0
普陀区常德路1258弄,0,0
普陀区常德路1269号,0,0
普陀区常德路1295号,0,0
普陀区常德路1391号,0,0
普陀区大渡河路1122号,0,0
普陀区大渡河路1262弄,0,0
普陀区大渡河路1332弄,0,0
普陀区大渡河路1400弄,0,0
普陀区大渡河路21弄,0,0
普陀区丹巴路1500弄,0,0
普陀区定边路377弄,0,0
普陀区东新路355弄,0,0
普陀区东新路88弄,0,0
普陀区东新路99弄,0,0
普陀区东新支路55弄,0,0
普陀区甘泉一村,0,0
普陀区甘泉三村,0,0
普陀区古浪路355弄,0,0
普陀区古浪路518弄,0,0
普陀区光复西路1145弄,0,0
普陀区光复西路683弄,0,0
普陀区光复西路777弄,0,0
普陀区光新路430弄,0,0
普陀区红棉路311弄,0,0
普陀区沪太路1010号,0,0
普陀区华阴路99号,0,0
普陀区黄陵路200弄,0,0
普陀区江宁路1078号,0,0
普陀区江宁路1220弄,0,0
普陀区江宁路1251弄,0,0
普陀区江宁路1389弄,0,0
普陀区江宁路1415弄,0,0
普陀区交通路1461弄,0,0
普陀区交通路2285弄,0,0
普陀区交通路4603弄,0,0
普陀区交通西路48弄,0,0
普陀区胶州路1077弄,0,0
普陀区胶州路1118弄,0,0
普陀区胶州路1155弄,0,0
普陀区胶州路959弄,0,0
普陀区胶州路960弄,0,0
普陀区金鼎路1600弄,0,0
普陀区金沙江路1066弄,0,0
普陀区金沙江路2115号,0,0
普陀区金通路1118弄,0,0
普陀区泾阳路376号,0,0
普陀区靖边路199弄,0,0
普陀区靖边路299弄,0,0
普陀区骊山路34弄,0,0
普陀区连亮路111弄,0,0
普陀区柳园路258号,0,0
普陀区柳园路599号,0,0
普陀区绿杨路36弄,0,0
普陀区绿杨路51弄,0,0
普陀区梅川路1111弄,0,0
普陀区梅川路1333弄,0,0
普陀区梅川路1500弄,0,0
普陀区梅川路278弄,0,0
普陀区梅川路800弄,0,0
普陀区梅川路947弄,0,0
普陀区梅川路999弄,0,0
普陀区梅岭北路1101弄,0,0
普陀区梅岭北路1168弄,0,0
普陀区梅岭北路1258弄,0,0
普陀区梅六小区,0,0
普陀区莫干山路600号,0,0
普陀区农林路101弄,0,0
普陀区怒江北路219弄,0,0
普陀区怒江路600弄,0,0
普陀区怒江路651弄,0,0
普陀区平利路90弄,0,0
普陀区普雄路26弄,0,0
普陀区普雄路29弄,0,0
普陀区祁安路365弄,0,0
普陀区祁安路368弄,0,0
普陀区祁连山南路2727弄,0,0
普陀区千阳路271弄,0,0
普陀区千阳南路49号,0,0
普陀区清峪路130弄,0,0
普陀区清峪路81弄,0,0
普陀区陕西北路1283弄,0,0
普陀区石岚三村,0,0
普陀区石泉东路168弄,0,0
普陀区石泉六村,0,0
普陀区石泉路130弄,0,0
普陀区石泉路227弄,0,0
普陀区石泉路290号,0,0
普陀区绥德路607号,0,0
普陀区泰山一村,0,0
普陀区泰山二村,0,0
普陀区泰山三村,0,0
普陀区糖坊街,0,0
普陀区桃浦路1108弄,0,0
普陀区桃浦路1149弄,0,0
普陀区桃浦路1341弄,0,0
普陀区桃浦路1825号,0,0
普陀区桃浦路1863号,0,0
普陀区桃浦路1883号,0,0
普陀区桃浦路1925弄,0,0
普陀区桃浦路2055弄,0,0
普陀区桃浦路743弄,0,0
普陀区桃浦西路443弄,0,0
普陀区铁路新村,0,0
普陀区同普路1155号,0,0
普陀区同普路1680弄,0,0
普陀区铜川路1780弄,0,0
普陀区铜川路58弄,0,0
普陀区武宁路2089号,0,0
普陀区武宁路2525弄,0,0
普陀区武宁路74弄,0,0
普陀区武宁一村,0,0
普陀区武威东路821弄,0,0
普陀区武威路1019弄,0,0
普陀区武威路1082弄,0,0
普陀区武威路1087弄,0,0
普陀区武威路1236弄21支弄,0,0
普陀区武威路2358号,0,0
普陀区西康路1000号,0,0
普陀区西康路1048号,0,0
普陀区西康路1249弄,0,0
普陀区西康路1369号,0,0
普陀区西康路1518弄,0,0
普陀区西谈家渡路17弄,0,0
普陀区西谈家渡路39弄,0,0
普陀区西乡路105弄,0,0
普陀区西乡路91弄,0,0
普陀区香泉路85弄,0,0
普陀区新村路170弄,0,0
普陀区新村路248弄,0,0
普陀区新村路285弄,0,0
普陀区新村路50弄,0,0
普陀区新会路504号,0,0
普陀区雪松路393弄,0,0
普陀区雪松路458弄,0,0
普陀区延长西路526弄,0,0
普陀区叶家宅路100号,0,0
普陀区宜川一村,0,0
普陀区宜川二村,0,0
普陀区宜川三村,0,0
普陀区宜川四村,0,0
普陀区宜川五村,0,0
普陀区宜川六村,0,0
普陀区宜君路169号,0,0
普陀区银杏路120弄,0,0
普陀区银杏路30弄,0,0
普陀区真北路1027号,0,0
普陀区真北路1029弄,0,0
普陀区真北路1101弄,0,0
普陀区真北路1524弄,0,0
普陀区真北路1902弄,0,0
普陀区真北路3725弄,0,0
普陀区真陈路399号,0,0
普陀区真光路798弄,0,0
普陀区真光路962弄,0,0
普陀区真南路3435弄,0,0
普陀区真南路3489弄,0,0
普陀区真南路648弄,0,0
普陀区真南路669号,0,0
普陀区真南路710弄,0,0
普陀区真南路744弄,0,0
普陀区真南路822弄,0,0
普陀区真南路843弄,0,0
普陀区真如西村,0,0
普陀区镇坪路176弄,0,0
普陀区镇坪路177弄,0,0
普陀区志丹路155号,0,0
普陀区志丹路400弄,0,0
普陀区中江路1067弄,0,0
普陀区中江路839号,0,0
普陀区中山北路1482号,0,0
普陀区中山北路1760弄,0,0
普陀区中山北路1766号,0,0
普陀区中山北路2196弄,0,0
普陀区中山北路2525弄,0,0
普陀区中山北路2626弄,0,0
普陀区中潭路100弄,0,0
普陀区中潭路33弄,0,0
普陀区中潭路99弄,0,0
普陀区竹柳路50弄,0,0
普陀区棕榈路300弄,0,0
虹口区安国路223弄,0,0
虹口区安国路76号,0,0
虹口区巴林路83号,0,0
虹口区百官街28号,0,0
虹口区宝安路138弄,0,0
虹口区宝安支路85号,0,0
虹口区宝山路621号,0,0
虹口区保定路20弄,0,0
虹口区保定路230号,0,0
虹口区保定路299号,0,0
虹口区保定路418号,0,0
虹口区保定路502弄,0,0
虹口区保定路520弄,0,0
虹口区保宁路44号,0,0
虹口区北苏州路370号,0,0
虹口区长春路110号,0,0
虹口区长春路309号,0,0
虹口区长春路336号,0,0
虹口区长春路348号,0,0
虹口区长春路353号,0,0
虹口区场中路187弄,0,0
虹口区场中路380号,0,0
虹口区场中路4弄,0,0
虹口区场中路685弄,0,0
虹口区场中路755弄,0,0
虹口区场中路842弄,0,0
虹口区车站北路188弄,0,0
虹口区车站北路500弄,0,0
虹口区车站北路624弄,0,0
虹口区车站北路625弄,0,0
虹口区车站北路732弄,0,0
虹口区车站南路28号,0,0
虹口区车站南路407弄,0,0
虹口区池沟路16号,0,0
虹口区赤峰路335号,0,0
虹口区赤峰路370弄,0,0
虹口区赤峰路373弄,0,0
虹口区赤峰路377号,0,0
虹口区赤峰路379号,0,0
虹口区川公路176弄,0,0
虹口区大连路1079号,0,0
虹口区大连路125号,0,0
虹口区大连路23号,0,0
虹口区大连路919弄,0,0
虹口区大连路975弄,0,0
虹口区大连西路11号,0,0
虹口区大连西路13号,0,0
虹口区大连西路145弄,0,0
虹口区大连西路155号,0,0
虹口区大连西路157号,0,0
虹口区大连西路165弄,0,0
虹口区大连西路201弄,0,0
虹口区大连西路215弄,0,0
虹口区大连西路261号,0,0
虹口区大连西路615号,0,0
虹口区大连西路74号,0,0
虹口区大连西路90号,0,0
虹口区丹徒路377号,0,0
虹口区东宝兴路254弄,0,0
虹口区东宝兴路461号,0,0
虹口区东汉阳路338弄,0,0
虹口区东汉阳路410号,0,0
虹口区东汉阳路450号,0,0
虹口区东汉阳路490号,0,0
虹口区东横浜路122弄,0,0
虹口区东江湾路580弄,0,0
虹口区东江湾路590号,0,0
虹口区东体育会路100弄,0,0
虹口区东体育会路115弄,0,0
虹口区东体育会路119弄,0,0
虹口区东体育会路355弄,0,0
虹口区东体育会路359号,0,0
虹口区东体育会路657弄,0,0
虹口区东体育会路659弄,0,0
虹口区东体育会路77号,0,0
虹口区东体育会路87号,0,0
虹口区东体育会支路65弄,0,0
虹口区东余杭路1158弄,0,0
虹口区东余杭路1168号,0,0
虹口区东余杭路1371号,0,0
虹口区多伦路201弄,0,0
虹口区峨嵋路299弄,0,0
虹口区飞虹路187弄,0,0
虹口区飞虹路237弄,0,0
虹口区飞虹路360弄,0,0
虹口区飞虹路369弄,0,0
虹口区飞虹支路57号,0,0
虹口区飞虹支路76号,0,0
虹口区飞虹支路83弄,0,0
虹口区丰镇路14弄,0,0
虹口区丰镇路2弄,0,0
虹口区丰镇路788号,0,0
虹口区高阳路553号,0,0
虹口区公安街153弄,0,0
虹口区公平路369号,0,0
虹口区公平路402弄,0,0
虹口区公平路469弄,0,0
虹口区公平路768弄,0,0
虹口区沽源路111弄,0,0
虹口区沽源路113弄,0,0
虹口区广灵二村,0,0
虹口区广灵二路264弄,0,0
虹口区广灵二路277号,0,0
虹口区广灵二路354弄,0,0
虹口区广灵二路380弄,0,0
虹口区广灵二路385弄,0,0
虹口区广灵四路572弄,0,0
虹口区广灵一村,0,0
虹口区广灵一路46号,0,0
虹口区广粤路1500弄,0,0
虹口区广粤路1601弄,0,0
虹口区广粤路58号,0,0
虹口区广中二村,0,0
虹口区广中路525弄,0,0
虹口区广中五村,0,0
虹口区广中一村,0,0
虹口区广中支路194弄,0,0
虹口区广中支路24弄,0,0
虹口区哈尔滨路273号,0,0
虹口区哈尔滨路291号,0,0
虹口区海伦路306弄,0,0
虹口区海伦路555弄,0,0
虹口区海伦路69号,0,0
虹口区海伦西路101号,0,0
虹口区海门路630号,0,0
虹口区海宁路137号,0,0
虹口区海宁路5号,0,0
虹口区邯郸路39号,0,0
虹口区邯郸路47弄,0,0
虹口区邯郸路53号,0,0
虹口区恒业路115弄,0,0
虹口区恒业路118弄,0,0
虹口区恒业路129弄,0,0
虹口区恒业路217弄,0,0
虹口区恒业路360号,0,0
虹口区恒业路367弄,0,0
虹口区恒业路388弄,0,0
虹口区横浜路123弄,0,0
虹口区横浜路35弄,0,0
虹口区横浜路47号,0,0
虹口区横浜路75号,0,0
虹口区衡水路367号,0,0
虹口区虹关路368号,0,0
虹口区虹湾路288弄,0,0
虹口区虹湾路313弄,0,0
虹口区虹湾路55弄,0,0
虹口区虹湾路86弄,0,0
虹口区虹镇老街251弄,0,0
虹口区虹镇老街267号,0,0
虹口区胡家木桥路301号,0,0
虹口区胡家木桥路35弄,0,0
虹口区胡家木桥路8号,0,0
虹口区华昌路183弄,0,0
虹口区华昌路9号,0,0
虹口区华严路211弄,0,0
虹口区惠民路117弄,0,0
虹口区惠民路140弄,0,0
虹口区惠民路257号,0,0
虹口区霍山路288号,0,0
虹口区霍山路68号,0,0
虹口区霍山路86号,0,0
虹口区吉祥路84弄,0,0
虹口区江杨南路55弄,0,0
虹口区蒋家桥路6号,0,0
虹口区蒋家桥路8号,0,0
虹口区九龙路311号,0,0
虹口区九龙路515号,0,0
虹口区昆明路173号,0,0
虹口区昆山路103弄,0,0
虹口区昆山路136弄,0,0
虹口区昆山路172弄,0,0
虹口区溧阳路1040号,0,0
虹口区溧阳路1203弄,0,0
虹口区溧阳路1333弄,0,0
虹口区溧阳路267号,0,0
虹口区凉城路1201弄,0,0
虹口区凉城路1319号,0,0
虹口区凉城路430弄,0,0
虹口区凉城路465弄,0,0
虹口区凉城路560弄,0,0
虹口区凉城路585弄,0,0
虹口区凉城路589弄,0,0
虹口区临平北路5弄,0,0
虹口区临平北路60弄,0,0
虹口区临平北路68号,0,0
虹口区临平北路89弄,0,0
虹口区临平路256弄,0,0
虹口区临平路25弄,0,0
虹口区密云路471弄,0,0
虹口区密云路611弄,0,0
虹口区闵行路260号,0,0
虹口区欧阳路317号,0,0
虹口区欧阳路328弄,0,0
虹口区欧阳路331号,0,0
虹口区欧阳路501弄,0,0
虹口区欧阳路545弄,0,0
虹口区欧阳路57号,0,0
虹口区蟠龙街26号,0,0
虹口区平凉路67号,0,0
虹口区曲阳路118弄,0,0
虹口区曲阳路28号,0,0
虹口区曲阳路31号,0,0
虹口区曲阳路379号,0,0
虹口区曲阳路385弄,0,0
虹口区曲阳路440号,0,0
虹口区曲阳路475弄,0,0
虹口区曲阳路487弄,0,0
虹口区曲阳路594号,0,0
虹口区曲阳路620号,0,0
虹口区曲阳路69弄,0,0
虹口区曲阳路789号,0,0
虹口区曲阳路820弄,0,0
虹口区曲阳路851弄,0,0
虹口区曲阳路92号,0,0
虹口区曲阳路990弄,0,0
虹口区瑞虹路233弄,0,0
虹口区瑞虹路25弄,0,0
虹口区瑞虹路438弄,0,0
虹口区瑞虹路439号,0,0
虹口区瑞虹路8弄,0,0
虹口区三门路1279号,0,0
虹口区三门路1729号,0,0
虹口区山阴路15号,0,0
虹口区山阴路57弄,0,0
虹口区山阴路69弄,0,0
虹口区山阴路85弄,0,0
虹口区商丘路399弄,0,0
虹口区水电路1013弄,0,0
虹口区水电路1320弄,0,0
虹口区水电路1324弄,0,0
虹口区水电路1600弄,0,0
虹口区水电路1660弄,0,0
虹口区水电路1666弄,0,0
虹口区水电路191弄,0,0
虹口区水电路201号,0,0
虹口区水电路261弄,0,0
虹口区水电路386弄,0,0
虹口区水电路62弄,0,0
虹口区水电路682号,0,0
虹口区水电路737弄,0,0
虹口区四川北路1274号,0,0
虹口区四川北路1545弄,0,0
虹口区四川北路1588号,0,0
虹口区四川北路1604弄,0,0
虹口区四川北路1606号,0,0
虹口区四川北路1774弄,0,0
虹口区四川北路1800号,0,0
虹口区四川北路1851号,0,0
虹口区四川北路1878号,0,0
虹口区四川北路1885号,0,0
虹口区四川北路1906弄,0,0
虹口区四川北路1953弄,0,0
虹口区四川北路1960号,0,0
虹口区四川北路1999弄,0,0
虹口区四川北路199弄,0,0
虹口区四川北路2019号,0,0
虹口区四川北路2023弄,0,0
虹口区四川北路41号,0,0
虹口区四川北路55号,0,0
虹口区四川北路708号,0,0
虹口区四川北路75号,0,0
虹口区四川北路85号,0,0
虹口区四达路166弄,0,0
虹口区四达路25弄,0,0
虹口区四达路49号,0,0
虹口区四达路57号,0,0
虹口区四达路58弄,0,0
虹口区四达路99弄,0,0
虹口区四平路311号,0,0
虹口区四平路327弄,0,0
虹口区四平路333号,0,0
虹口区四平路372号,0,0
虹口区四平路373号,0,0
虹口区四平路421弄,0,0
虹口区四平路448号,0,0
虹口区四平路488号,0,0
虹口区四平路52弄,0,0
虹口区四平路575弄,0,0
虹口区四平路577号,0,0
虹口区四平路57号,0,0
虹口区四平路621弄,0,0
虹口区四平路639号,0,0
虹口区四平路641号,0,0
虹口区四平路758弄,0,0
虹口区太平桥支路8号,0,0
虹口区塘沽路308弄,0,0
虹口区天宝路466弄,0,0
虹口区天宝路66弄,0,0
虹口区天宝路839号,0,0
虹口区天宝路881号,0,0
虹口区天宝路902号,0,0
虹口区天宝西路231弄,0,0
虹口区天宝西路242弄,0,0
虹口区天宝西路248弄,0,0
虹口区天宝西路252弄,0,0
虹口区天宝西路4弄,0,0
虹口区天水路172号,0,0
虹口区天通庵路666弄,0,0
虹口区天潼路508号,0,0
虹口区通州路188弄,0,0
虹口区通州路419弄,0,0
虹口区同丰路666弄,0,0
虹口区同鸣路140弄,0,0
虹口区同鸣路143号,0,0
虹口区同鸣路149号,0,0
虹口区同鸣路157号,0,0
虹口区同鸣路61号,0,0
虹口区同心路1115弄,0,0
虹口区同心路116弄,0,0
虹口区同心路124号,0,0
虹口区同心路125弄,0,0
虹口区同心路133弄,0,0
虹口区同心路189弄,0,0
虹口区同心路1号,0,0
虹口区同心路209弄,0,0
虹口区同心路232弄,0,0
虹口区同心路28弄,0,0
虹口区同心路338弄,0,0
虹口区同心路363弄,0,0
虹口区同心路921号,0,0
虹口区同心路990弄,0,0
虹口区万安路1213弄,0,0
虹口区万安路1323弄,0,0
虹口区万安路409弄,0,0
虹口区万安路669弄,0,0
虹口区万安路979弄,0,0
虹口区文迁路25弄,0,0
虹口区文治路30弄,0,0
虹口区文治路3弄,0,0
虹口区汶水东路181弄,0,0
虹口区汶水东路298弄,0,0
虹口区汶水东路510弄,0,0
虹口区汶水东路650弄,0,0
虹口区汶水东路690弄,0,0
虹口区汶水东路717弄,0,0
虹口区吴淞路355弄,0,0
虹口区吴淞路407弄,0,0
虹口区梧州路218弄,0,0
虹口区梧州路289号,0,0
虹口区梧州路298号,0,0
虹口区梧州路299弄,0,0
虹口区武昌路258号,0,0
虹口区武昌路338号,0,0
虹口区物华路118弄,0,0
虹口区物华路73号,0,0
虹口区物华路98弄,0,0
虹口区西江湾路122号,0,0
虹口区西江湾路143号,0,0
虹口区祥德路124弄,0,0
虹口区祥德路335号,0,0
虹口区新港路18号,0,0
虹口区新港路24号,0,0
虹口区新港路56号,0,0
虹口区新港路69号,0,0
虹口区新广路243号,0,0
虹口区新广路251支弄,0,0
虹口区新广路259号,0,0
虹口区新嘉路16号,0,0
虹口区新嘉路1弄,0,0
虹口区新市北路1491弄,0,0
虹口区新市北路1501弄,0,0
虹口区新市南路1133弄,0,0
虹口区新市南路515弄,0,0
虹口区新市南路841弄,0,0
虹口区邢家桥北路163弄,0,0
虹口区邢家桥北路55号,0,0
虹口区邢家桥南路61弄,0,0
虹口区伊敏河路50弄,0,0
虹口区逸仙路34号,0,0
虹口区银欣路38号,0,0
虹口区友谊二村,0,0
虹口区榆林路93弄,0,0
虹口区玉田新村,0,0
虹口区玉田支路2弄,0,0
虹口区岳州路319弄,0,0
虹口区岳州路399弄,0,0
虹口区岳州路423弄,0,0
虹口区岳州路50号,0,0
虹口区岳州路52号,0,0
虹口区运光路90弄,0,0
虹口区乍浦路163号,0,0
虹口区乍浦路250号,0,0
虹口区乍浦路308号,0,0
虹口区乍浦路321号,0,0
虹口区中山北一路1102弄,0,0
虹口区中山北一路1108号,0,0
虹口区中山北一路131弄,0,0
虹口区中山北一路644弄,0,0
虹口区中山北一路666号,0,0
虹口区中山北一路6号,0,0
虹口区中山北一路865号,0,0
虹口区中州路66号,0,0
虹口区周家嘴路1048号,0,0
虹口区周家嘴路607号,0,0
虹口区周家嘴路734号,0,0
虹口区周家嘴路807号,0,0
虹口区周家嘴路86弄,0,0
虹口区株洲路258弄,0,0
杨浦区爱国二村,0,0
杨浦区爱国路152号,0,0
杨浦区爱国路301弄,0,0
杨浦区鞍山六村,0,0
杨浦区鞍山路215弄,0,0
杨浦区鞍山七村,0,0
杨浦区鞍山三村,0,0
杨浦区鞍山四村,0,0
杨浦区鞍山五村,0,0
杨浦区鞍山一村,0,0
杨浦区白洋淀新村,0,0
杨浦区包头路300弄,0,0
杨浦区包头南路588弄,0,0
杨浦区本溪路137号,0,0
杨浦区本溪路138弄,0,0
杨浦区本溪路139号,0,0
杨浦区本溪路141弄,0,0
杨浦区沧州路180弄,0,0
杨浦区长白二村,0,0
杨浦区长白三村,0,0
杨浦区长海新村,0,0
杨浦区长海一村,0,0
杨浦区长岭路60弄,0,0
杨浦区长阳路1318弄,0,0
杨浦区长阳路1400弄,0,0
杨浦区长阳路1658弄,0,0
杨浦区长阳路1689号,0,0
杨浦区长阳路1839弄,0,0
杨浦区长阳路1969弄,0,0
杨浦区长阳路1980号,0,0
杨浦区长阳路2087弄,0,0
杨浦区长阳路860号,0,0
杨浦区长阳路910弄,0,0
杨浦区打虎山路6弄,0,0
杨浦区大连路1228号,0,0
杨浦区大连路1548号,0,0
杨浦区大连路848弄,0,0
杨浦区大连西路30弄,0,0
杨浦区定海路150号,0,0
杨浦区敦化路4弄,0,0
杨浦区飞虹路1047弄,0,0
杨浦区飞虹路628号,0,0
杨浦区飞虹路740号,0,0
杨浦区凤城二村,0,0
杨浦区凤城六村,0,0
杨浦区凤城三村,0,0
杨浦区凤城一村,0,0
杨浦区凤南一村,0,0
杨浦区抚顺路363弄,0,0
杨浦区阜新路169弄,0,0
杨浦区阜新路180弄,0,0
杨浦区阜新路182弄,0,0
杨浦区港水路2600号,0,0
杨浦区广远新村,0,0
杨浦区贵阳路30弄,0,0
杨浦区国定路555弄,0,0
杨浦区国定路580弄,0,0
杨浦区国定路600弄,0,0
杨浦区国定路700弄,0,0
杨浦区国福路30弄,0,0
杨浦区国和二村,0,0
杨浦区国和路445弄,0,0
杨浦区国和路611弄,0,0
杨浦区国和一村,0,0
杨浦区国年路101弄,0,0
杨浦区国年路160弄,0,0
杨浦区国年路250弄,0,0
杨浦区国权东路99弄,0,0
杨浦区国权路333弄,0,0
杨浦区国权路336弄,0,0
杨浦区国顺东路26弄,0,0
杨浦区国顺路571号,0,0
杨浦区国顺路650弄,0,0
杨浦区国顺路81弄,0,0
杨浦区国伟路456号,0,0
杨浦区海州路83号,0,0
杨浦区邯郸路470弄,0,0
杨浦区河间路1417号,0,0
杨浦区河间路555弄,0,0
杨浦区河间路827弄,0,0
杨浦区怀德路560号,0,0
杨浦区浣纱三村,0,0
杨浦区黄兴路1039弄,0,0
杨浦区黄兴路1100号,0,0
杨浦区黄兴路1669弄,0,0
杨浦区黄兴路1号,0,0
杨浦区黄兴路2020弄,0,0
杨浦区黄兴路2053弄,0,0
杨浦区佳木斯路175弄,0,0
杨浦区佳木斯路191弄,0,0
杨浦区佳木斯路270号,0,0
杨浦区江浦路1188弄,0,0
杨浦区江浦路1275弄,0,0
杨浦区江浦路1315弄,0,0
杨浦区锦西路100弄,0,0
杨浦区锦西路30弄,0,0
杨浦区锦州湾路27弄,0,0
杨浦区靖宇东路55弄,0,0
杨浦区靖宇东路58弄,0,0
杨浦区靖宇东路85弄,0,0
杨浦区靖宇南路118弄,0,0
杨浦区靖宇南路5弄,0,0
杨浦区靖宇南路99弄,0,0
杨浦区军工1300号,0,0
杨浦区军工路1076号,0,0
杨浦区军工路2866号,0,0
杨浦区军工路601号,0,0
杨浦区开鲁二村,0,0
杨浦区开鲁三村,0,0
杨浦区控江二村,0,0
杨浦区控江六村,0,0
杨浦区控江路1039弄,0,0
杨浦区控江路1200弄,0,0
杨浦区控江路121弄,0,0
杨浦区控江路129弄,0,0
杨浦区控江路1447号,0,0
杨浦区控江路1667号,0,0
杨浦区控江路18弄,0,0
杨浦区控江路2200号,0,0
杨浦区控江路2202号,0,0
杨浦区控江路2224号,0,0
杨浦区控江路600号,0,0
杨浦区控江路640弄,0,0
杨浦区控江路89号,0,0
杨浦区控江路93号,0,0
杨浦区控江七村,0,0
杨浦区控江三村,0,0
杨浦区控江四村,0,0
杨浦区控江五村,0,0
杨浦区控江一村,0,0
杨浦区昆明路1268弄,0,0
杨浦区兰州路1100弄,0,0
杨浦区凉州路410号,0,0
杨浦区辽阳路68弄,0,0
杨浦区辽源西路230弄,0,0
杨浦区辽源一村,0,0
杨浦区临青路188号,0,0
杨浦区临青路284号,0,0
杨浦区隆昌路235号,0,0
杨浦区隆昌路532弄,0,0
杨浦区隆昌路541弄,0,0
杨浦区眉州路100弄,0,0
杨浦区眉州路135弄,0,0
杨浦区眉州路300号,0,0
杨浦区眉州路354弄,0,0
杨浦区眉州路420弄,0,0
杨浦区民府路199号,0,0
杨浦区民京路187号,0,0
杨浦区民京路239号,0,0
杨浦区民京路837弄,0,0
杨浦区民庆路祝家宅,0,0
杨浦区民星二村,0,0
杨浦区民星路50号,0,0
杨浦区南翔殷路81号,0,0
杨浦区内江二村,0,0
杨浦区内江路17号,0,0
杨浦区内江路222弄,0,0
杨浦区内江路374弄,0,0
杨浦区内江路384弄,0,0
杨浦区内江路9号,0,0
杨浦区嫩江路831弄,0,0
杨浦区宁国路58号,0,0
杨浦区宁国南路77号,0,0
杨浦区宁武路269号,0,0
杨浦区平凉路1157弄,0,0
杨浦区平凉路1365弄,0,0
杨浦区平凉路1545弄,0,0
杨浦区平凉路1730号,0,0
杨浦区平凉路1782弄,0,0
杨浦区平凉路1889弄,0,0
杨浦区平凉路2103号,0,0
杨浦区平凉路2545弄,0,0
杨浦区平凉路2625弄,0,0
杨浦区平凉路2667弄,0,0
杨浦区平凉路624号,0,0
杨浦区虬江码头路5号,0,0
杨浦区三门路358弄,0,0
杨浦区三门路510弄,0,0
杨浦区沙岗路888号,0,0
杨浦区沈家桥小区,0,0
杨浦区世界路103号,0,0
杨浦区世界路151弄,0,0
杨浦区世界路99弄,0,0
杨浦区市光二村,0,0
杨浦区市光路133弄,0,0
杨浦区市光路138号,0,0
杨浦区市光路143弄,0,0
杨浦区市光路146弄,0,0
杨浦区市光路165弄,0,0
杨浦区市光路166弄,0,0
杨浦区市光路176号,0,0
杨浦区市光三村,0,0
杨浦区市光一村,0,0
杨浦区市京一村,0,0
杨浦区双辽路200弄,0,0
杨浦区双辽新村,0,0
杨浦区双辽支路45弄,0,0
杨浦区双辽支路65弄,0,0
杨浦区双阳北路288弄,0,0
杨浦区双阳二村,0,0
杨浦区双阳路109号,0,0
杨浦区双阳路160弄,0,0
杨浦区双阳路293弄,0,0
杨浦区双阳路300弄,0,0
杨浦区双阳路594弄,0,0
杨浦区双阳路604弄,0,0
杨浦区双阳路666弄,0,0
杨浦区双阳一村,0,0
杨浦区双阳支路28弄,0,0
杨浦区双阳支路58弄,0,0
杨浦区顺平路59弄,0,0
杨浦区四平路1028弄,0,0
杨浦区四平路1790号,0,0
杨浦区四平路1950弄,0,0
杨浦区四平路949弄,0,0
杨浦区松花江路1160弄,0,0
杨浦区松花江路127号,0,0
杨浦区松花一村,0,0
杨浦区唐山路1188弄,0,0
杨浦区铁岭路10弄,0,0
杨浦区铁岭路50弄,0,0
杨浦区通北路888号,0,0
杨浦区同济新村,0,0
杨浦区武川路222弄,0,0
