title,time,hot,emo,count
上海新增本土无症状降至1万以下,749,1057,中性,1
上海通报：6岁以下儿童阳性感染者12707例,1945,798,中性,1
上海：聚焦重点集中发力加快实现社会面清零目标,951,366,中性,1
热点 | 同济大学致歉,1821,313,负面,2
上海青浦多支疫苗接种小分队进入村居，提高老年人接种疫苗的覆盖率,2025,293,中性,1
上海花博会停车场临时隔离点分批交付可提供超6000套隔离标间,1719,268,中性,1
给鱼做抗原检测显示阳性，它也会感染新冠,409,251,中性,1
就医“三辆车”，保供“满天星”,1356,224,正面,1
劳动者被隔离期间用人单位仍应正常发工资，市高院市人社局联合发布解答,1736,217,中性,2
离职员工倒卖原公司价值800余万元秘密资料 买卖双方均获刑,1533,206,负面,1
新华全媒+｜港口转起来，货物动起来洋山深水港目击记,132,205,中性,1
上海已排摸到非沪籍盲人445名，均已纳入各区残联属地基本生活保供范围,1452,187,中性,2
上海强化中医药干预，发放汤剂超400万人份,2030,180,中性,2
“我就想帮个忙”，人美心更美的法国姑娘骑着“电驴”服务居民丨守望在春天里,1112,170,正面,1
上海：本轮疫情首家进入闭环的医院已全面恢复医疗服务,2123,169,中性,3
上海“芯”火不熄保生产,1004,169,中性,2
上海进一步加强疫情期间特殊困难群体保障,454,169,中性,2
争创“无疫小区”：每幢楼、每个人都是命运共同体,1448,167,正面,3
上海发布出院出舱返家消毒与防护指南,2039,163,中性,4
上海市社会面疫情风险正逐步降低防反弹防外溢任务十分艰巨,1737,161,中性,3
多少可爱的00后奔赴抗疫一线，用真心与真情宣告“我已经长大了,1006,161,正面,3
上海边检保口岸运营通畅、助企业复工复产,2031,155,中性,5
上海闵行推动1.14万名机关干部、6万名在职党员向社区报到,2044,153,正面,6
上海全力保障港口运转通畅集装箱吞吐量同比增长8.14%,1935,153,中性,3
松江积极推进防疫春耕双线作战,1459,152,正面,4
上海消防特勤支队：哪里最需要，就战斗在哪里,1425,151,正面,5
上海ICU危重症医学“尖刀班”：跟病毒“拼刺刀”,1022,145,正面,4
（上海战疫录）上海全力救治重症患者定点医院患者平均住院5.49天,1008,145,中性,5
划分55个“微网格”，这个街道以“小网格”筑起疫情防控“大屏障”,1007,145,中性,6
实地探访：上海部分企业恢复生产经营状况如何,1351,140,中性,2
”上海大学有支“橄榄绿”抗疫突击队,1922,134,正面,4
（上海战疫录）“背”感温暖三位“90后”姑娘化身“战袍画手”为抗疫加油,1105,134,正面,7
橙汁可乐能显阳？抗原检测操作需规范,410,129,中性,3
上海5月1日至6月30日实行免费核酸检测,1808,124,中性,5
商务部：正加大协调推动力度全力保障上海外企复工复产,1726,120,中性,4
解锁保时捷引领潮流的秘密：持续进化/不断创新,1603,119,中性,5
上海一小区称“京东没资格送货”？闵行区梅陇镇回应,930,118,负面,2
微光守沪｜00后分拣员暗暗“较劲”：怎么也不能比来沪支援的同事做得少,1505,114,中性,6
上海专家：坚持“动态清零”不动摇，保障人民生命健康,707,112,正面,2
多家国际投行疫情之下在上海推行扩张计划,50,111,中性,2
学霸们的花式网课笔记来了,2016,110,中性,7
上海战疫看点｜社区工作者的抗疫日常：我是小区“团长”兼“家长”,1009,110,正面,8
上海每户每天有60元保供物资标准,1742,108,中性,6
上海商场陆续复工复产 加入城市保供行列,1343,102,中性,3
上海市公安局普陀分局长寿路派出所：日送万份餐 副所长兼任“盒饭团长”,1022,94,中性,9
有爱！老人就医行动不便小伙公主抱护送,1329,93,正面,4
随申办上线复工证、通行证，能申请吗,1230,92,中性,5
上海女高材生制售猫药治绝症被刑拘，律师解读所涉法律问题,1038,92,负面,10
随身行李建议放置14天后再打开，出院出舱人员返家消毒防护提示发布,1125,89,中性,11
上海前游泳名将做志愿者摔瘫痪,1111,86,负面,12
多国暴发儿童急性肝炎与新冠病毒及疫苗有关,1108,79,中性,13
上海：累计排查在沪密接者556709人均已落实管控,1007,79,中性,14
上海一公司供应三无产品、异味大米，被立案调查,2249,77,负面,1
守“沪”日志：争取疫情防控主动权上海布设常态化核酸采样点,809,71,中性,3
中国进出口银行发行50亿元“支持上海抗疫保供”主题金融债券,2006,70,中性,8
从严从重从快！上海出手了,1613,67,负面,7
广西第二批援沪物资已到达上海：上海人民收到后还拍了开箱视频！一起感受下有多好吃,1356,60,正面,6
上海家化披露一季报：净利润同比增17.81%，经营质量稳中有进,2135,57,中性,9
4月28日上海市、区主要医疗机构暂停医疗服务情况,1308,57,中性,7
上海社区民警王瑞芳“把群众的事情办好，才叫有担当”（抓细抓实各项防疫工作）,1259,57,正面,8
央行上海总部：长三角一季度人民币贷款增加2.83万亿元,1452,55,中性,7
同济大学回应学生盒饭吃出异物,1725,52,负面,8
民航局：上海浦东机场货运保障能力快速恢复,1422,51,中性,8
收到钱后就拉黑，男子冒充“跑腿小哥”接单诈骗5000余元,1119,51,负面,15
理性看待黄金“避险资产”作用,648,50,中性,3
上海两万金融人“逆行”岗位驻守“满月”,1959,49,正面,6
商务部：12省份累计供应上海蔬菜27808吨,1617,49,中性,9
中国学者大规模队列研究发现：适当晒太阳有助预防阿尔兹海默症,1629,48,中性,10
代购香烟实为诈骗 嫌疑人骗得10余人9000多元被抓获,830,46,负面,4
拍案丨知识产权不容侵犯,2151,45,负面,10
父母双亡或丧失劳动能力后，成年哥哥姐姐必须抚养未成年弟弟妹妹吗？,850,42,中性,5
这一代年轻人，一边喊着“躺平”一边努力奋斗|光明网评论员,1820,41,中性,7
上海战疫看点｜涉疫垃圾处置者，守牢防疫“最后一公里”,1510,39,正面,9
上交所全力守“沪”金融稳定上市公司复工复产加速跑,701,39,中性,4
上海不曾中断的流调,730,38,中性,5
不用消毒剂也能消毒？快学起来,1818,37,中性,8
这些消毒器械派啥用场,1750,37,中性,11
上海市民团购到“未来”牛肉,1215,37,负面,9
一封感谢信背后的光明力量：97岁患病老人想喝牛奶，光明员工“疫”不容辞,1915,36,正面,9
曝光！商品过度包装执法典型案例公布,1808,35,中性,10
北大女博士竞选城管，被嘲“读书无用”：今天，我想为她说句公道话,810,35,中性,6
高空抛物涉及的法律问题，别让它抛掉你的自由！,1025,34,负面,16
杨浦区核酸采样辅助人员志愿者招募,2116,33,中性,11
2022年上海市全国五一劳动奖状（章）、工人先锋号揭晓,1911,33,正面,11
防疫科普丨每次都是阴性，为什么还要持续做核酸,1847,33,中性,12
仁济南院定点医院ICU救治实录,924,33,中性,7
青浦农业企业有序复工复产，拉开春耕大幕,1445,32,中性,10
人民日报：“清零”有三个层次的含义,1006,32,中性,17
上海港：全力保障供应链不中断,753,32,正面,6
新华全媒+丨战完“雷神山”后，他们又转战上海,2230,31,正面,2
疫情中，如何面对来自身体的“情绪信号”,2130,31,中性,12
上海战疫看点｜我家小区来了“机器人志愿者”,1911,31,正面,13
新华时评|坚持“动态清零”，尤其要呵护好特殊群体,1100,30,中性,18
为保供奔波之后，小哥有了歇脚睡觉的舒适“小窝”,1018,30,中性,19
上海市龙华东路方舱医院首批8名患者康复出院,949,30,正面,8
多家民营房企获并购融资额度合计超千亿，未来资产买卖或更频繁,817,30,正面,9
这家医院开通首个专科医师咨询热线,1750,29,中性,12
三城接力，四次转运！京宁沪接力为罕见病患儿送救命奶粉,1556,29,中性,11
洗衣皂、洗衣粉、果蔬清洗剂社区团购时如何辨别质量好坏,1334,29,中性,10
探路者贴身护航13载|中国第38次南极考察队凯旋,929,29,中性,10
为了4000多居民及时配药，他们建立了一套配药“跟单系统”,924,29,正面,11
公告｜闵行区“三区”划分公告（附华漕镇4月27日最新调整）,1834,28,中性,14
上海新增死亡47例，24天来首次新增感染低于1万例，已是6连降,1323,28,中性,11
电话“点名”，她听出独居老人脑梗了上海金山：各方合力守望“无疫小区”,831,28,正面,12
浦发银行：推进金融市场业务转型，担纲上海国际金融中心建设重任,1732,27,中性,13
上海疫情中总有人不管不顾“发国难财”，必须依法严惩！,1546,27,中性,12
历时174天，他们都做了什么,631,27,中性,7
2014年2月第三天上海消防,2145,26,中性,13
消毒剂味道越大效果越好吗？,2102,26,中性,14
上海金山：将于4月29日在全区范围内开展一次全员核酸筛查,1854,26,中性,15
（上海战疫录）日籍医生小野：驻守医院，却感到邻里间暖意,1710,26,正面,14
微博全面上线新功能，用户无法主动开启或关闭,1642,26,中性,15
交通运输部：在上海及周边地区启用3个应急物资中转站,1637,26,中性,16
上海市委常委会会议研究部署当前全市疫情防控工作,2331,25,中性,3
上海海关“资源类及高值产品产地溯源、掺假识别技术研究”通过验收,2055,25,中性,15
抗疫情抓发展丨机器响起来链条转起来上海重点企业复工复产一线直击,51,25,中性,3
致敬！上海疫情下了不起的普通人,1948,24,正面,16
歌尔股份上半年预盈至24亿，股价连续两日涨停，多路资金争先买入,1659,24,中性,17
南汇8424西瓜+南汇玉菇瓜,1640,24,中性,18
上海首批便民核酸采样点投入使用，长这样,1232,24,中性,12
我们盘点了各区疫情最新走势,2241,23,中性,4
文明健康绿色环保|这一刻，用“心”的力量，与您相伴,2130,23,正面,16
纸张业务不能计入营收，这家公司自救“保壳”失败,2050,23,负面,17
康复者返家如何消毒，家庭如何开展终末消毒,1607,23,中性,19
解决群众“药罐子”难题，这些下沉干部全力以赴,2102,22,正面,18
凌云这个近5000人居民区，公务员、健身教练、创业者都来当大白,1815,22,正面,17
以经营养老项目为名进行集资诈骗多位老人损失惨重,1749,22,负面,20
复星在沪企业有序推进复工复产,1558,22,中性,13
实拍上海120如何工作,1115,22,中性,20
党旗飘扬|妻子在维和部队执行任务，他和同伴们在一线抗疫,817,22,正面,13
机构：去年经销商利润上扬，新车销售收入占比提升至84%,1804,21,中性,18
“90后”机关干部在上海封控小区当楼组长，一个月后感叹三个“没想到”,1329,21,正面,13
重要提醒！在上海的滁州老乡速看,1220,21,中性,14
疫情下的共同守护：1300多人的小区，15%居民在做志愿者,816,21,正面,14
暖心微光丨在这个老龄化小区，居家办公的他们挥洒青春最美的模样,816,21,正面,15
湘财股份去年净利创新高，证券板块成业绩贡献主力军,1259,20,正面,15
多名“上海团长”疑似被骗,1215,20,负面,16
注意！门诊大病登记有效期延期！,1015,20,中性,21
上海分区封控已1个月，新增阳性病例迎来6连降,853,20,中性,16
党旗飘扬丨拧成一股绳亲如一家人,816,20,正面,17
A股年报榜起底：3500公司营收总额上涨20%市场大跌后如何“淘金”,734,20,中性,8
猪肉运费800元加到6000元，一袋米赚73元，上海严打发“疫情财”行为,1754,19,负面,21
安森美半导体在沪全球分拨中心复工复产,1549,19,中性,14
民航局预计“五一”旅客量降七成，大型航司每天亏掉1个亿,1531,19,中性,15
“上海正在一天天好起来”，美团买菜八成站点复工，16区开通“全城找药”,1512,19,中性,16
虎牙主播24小时轮播爱奇艺会员剧《琅琊榜》，虎牙平台是否该担责？,1112,19,负面,22
又一百亿私募大佬道歉，源乐晟曾晓洁：估值处于底部区间,938,19,负面,18
2022届上海高校毕业生春季线上直播招聘会将于今天10点启幕,817,19,中性,19
上海游泳队举行春季大奖赛张雨霏2022年首秀亮眼,2135,18,中性,19
沪本地菜卖不出去？,1134,18,中性,23
“守沪者联盟”丨上海严格实行“非必要不离沪”坚决防止疫情外溢,1103,18,中性,24
上海逐步恢复专科门诊特殊时期兜起市民就诊需求,906,18,正面,20
国家药监局综合司关于新冠肺炎疫情防控期间化妆品注册备案管理有关事项的复函,613,18,中性,9
直击上海ICU：托起老年重症患者的“生命方舟”,2230,17,正面,5
老人住进方舱后，我目击了他们的生活和救治,2105,17,正面,20
花盆种菜能实现“蔬菜自由”吗,1944,17,中性,19
疾控中心呼吁：符合条件的老年朋友尽快接种新冠疫苗,1943,17,中性,20
联创股份年报非标收问询函现金流与营收变动趋势背离,1824,17,中性,21
新华社记者在上海方舱的十天,1755,17,正面,22
关于2022年上海市中等学校高中阶段招生补报名延期进行的公告,1655,17,中性,23
超丰富线上下单攻略请查收,1649,17,中性,24
盛美上海跌19%创新低IPO超募16.8亿两券商赚1.74亿,1629,17,中性,25
嘉定区市场监督管理局公布新一批“团购”违法典型案例,1554,17,负面,17
药企一季度“成绩单”：万泰生物、上海谊众净利润增长超100%,1448,17,中性,18
上海市慈善基金会第二批10万余份社区高龄独居老人“关爱包”发放,1334,17,正面,17
消防安全小课堂酒精使用安全提示,905,17,中性,21
居家防疫以来送出超320万笔药品订单，外卖平台在上海16城区开通全城找药,815,17,中性,22
中国外汇交易中心：免除中小微企业外汇衍生品交易相关银行间外汇市场交易手续费,733,17,中性,10
“企”心合力，“疫”战到底,2229,16,正面,6
仁济医院：周一至周六均开门诊，“五一”假期按工作日照常开诊,2206,16,中性,7
造谣！性质恶劣！全部封停！,2104,16,负面,21
6旬爷爷买9箱甜瓜赠援沪医疗队 ，医护：这是一种双向奔赴的情感,2030,16,正面,22
足不出户在线就医，仁济互联网医院药品处方近2.4万张，24小时机器人客服上线,2015,16,中性,23
上海外企积极复工复产对中国市场信心不变,1834,16,正面,22
暖心微光丨除了捐献物资，这5家企业为战“疫”还做了这些,1652,16,正面,26
民警出手解难题|“疫”线警察蓝,1530,16,正面,19
这个“拔点工作组”多措并举，争分夺秒与病毒“赛跑”,1455,16,中性,20
日均吞吐量保持10万标准箱以上，洋山港是如何让货物动起来的,1125,16,中性,25
感谢有你！他们用微光照亮我们前行的路,940,16,正面,23
最常见上火症状的解决办法，管用,905,16,中性,24
青浦区核酸采样点查询功能在“随申办”青浦旗舰店上线,826,16,中性,25
“临时居委会班子”即将撤离，居民依依不舍写诗赞美,817,16,正面,26
来看老人和萌娃笔下的抗疫生活,810,16,正面,27
实业公司带着集贸市场，转身成为周边村居的“菜管家”,810,16,中性,28
上海最大自然村绘制疫情防控网格确保物资供应和配药,51,16,中性,4
上海这波疫情，把隔壁的苹果供应链们打傻了,0,16,负面,5
金山“桃太郎”番茄上市,2209,15,中性,8
1000万元小哥兜底工资补贴，最高50万元“复工金融包”圆通全力扶持网点复工复产,2105,15,正面,24
葛兰素史克联合爱德基金会驰援上海战疫,1852,15,正面,23
接力串起“送药链”，复旦儿科携手市青联为儿童配送紧急药品,1845,15,中性,24
火焰蓝助力1600余人紧急转移,1840,15,正面,25
这2幢楼的志愿者已有120多人！,1818,15,正面,26
一不小心，我就暴露身份了,1753,15,正面,27
当一名阳性感染者试图逃离方舱一群陌生人“出手”了,1745,15,负面,28
上海本轮疫情死亡病例有两大特点,1658,15,中性,29
中信保诚基金：微光成炬，齐心战疫显担当,1613,15,正面,30
陆家嘴：一季度净利润同比下降25.96%,1543,15,中性,21
纸短情长！纸条里的上海,1430,15,正面,22
我跟踪上海120急救车三天，目睹他们在封控社区抢救生命,825,15,正面,29
东方美谷集团志愿者提供精细服务,813,15,中性,30
海湾旅游区：来看“三驾马车”跑出防疫新合力,813,15,正面,31
上海茂兴路71号，32位盲人被“看见”,804,15,负面,32
上海贵酒股份产品品牌矩阵持续优化，2021年净利润增超6.7倍,744,15,正面,11
做血透的老人，穿冬装的特保，买咸蛋的医生|睡前分享,2221,14,负面,9
11张海报告诉你：疫情防控中，要特别注意哪些法律法规,1910,14,中性,27
上海市残联携手爱心企业 向视障人士赠送物资,2203,13,正面,10
粽子季已来！上海多家老字号推出粽子套餐,2121,13,中性,25
跨越半个中国驰援上海的快递小哥,1033,13,正面,26
跟病毒拼刺刀坚守生命防线,925,13,正面,33
救护车叫凿空？你信吗？,733,13,负面,12
张雨霏当助教指导年轻队员 ,2220,12,中性,11
市人社局发布疫情期间规范招聘用工服务的通告,1634,12,中性,31
业主能否直接取用“维修资金”？,1634,12,中性,32
定点医院平均住院5.49天,1417,12,中性,23
上海不少商家提供“一份起送”服务,1308,12,中性,18
女大学生面试内衣模特遭面试员猥亵，公司：是自愿的,904,12,负面,34
